product_name,product_price_rp
Hot Wheels Team Transport Euro Hauler & '94 Nissan 300 ZX GTS - Mainan Mobil Balap,309900
Hot Wheels Premium 2-Pack Pandem '96 Nissan 180SX Type X & Nissan SilEighty - Mainan Mobil Balap,239900
Hot Wheels Premium 2-Pack Pandem '71 AMC Javelin & AMC Rebel Machine - Mainan Mobil Balap,239900
Hot Wheels Silver Series 6-car Japan Multipack - Mainan Mobil Balap,349900
Hot Wheels Premium Collector Track Day Display Sets - Mainan Mobil Balap,559900
Hot Wheels Team Transport Dash E Series Bundle,929700
Hot Wheels Car Culture Dash F Series Bundle,649500
Hot Wheels City T-Rex Blaze Battle Playset - Mainan Trek Mobil Balap,559900
Hot Wheels 1:43 1969 Ford Mustang - Mainan Mobil Balap,159900
Hot Wheels Monster Trucks Big Rigs Skelesaurus - Mainan Mobil Balap,189900
Hot Wheels Skate Skull Grind - Mainan Fingerboard,94410
Hot Wheels City Mega Garage Playset - Mainan Trek Mobil Balap,999900
Matchbox Airport Takeoff Adventure Playset - Mainan Trek Mobil Balap,599900
Hot Wheels 1:43 Dimachini Veloce - Mainan Mobil Balap,159900
Hot Wheels Monster Trucks 2025 Lil Haulil '84 - Mainan Mobil Balap,99900
Hot Wheels 1:43 Muscle & Blown - Mainan Mobil Balap,159900
Hot Wheels Monster Trucks 2025 Piran-AHHH Vs Haul Y'aal - Mainan Mobil,189900
Hot Wheels Skate Bone Chillin - Mainan Fingerboard,94410
Hot Wheels Skate On Vacation - Mainan Fingerboard,94410
Hot Wheels Skate Grate Ride- Mainan Fingerboard,94410
Hot Wheels 1:43 Pull Racer (Random) - Mainan Mobil Balap,59900
Hot Wheels Monster Trucks 2025 Oscar Meyer Wienermobile - Mainan Mobil,99900
Hot Wheels 1:43 2023 Nissan Z Custom - Mainan Mobil Balap,159900
Hot Wheels Skate Talon Take-off - Mainan Fingerboard,94410
Hot Wheels Monster Trucks 2025 Town Hauler Vs Dodge Ram Van - Mainan,189900
Hot Wheels Skate Mickey Mouse - Mainan Fingerboard,94410
Hot Wheels Monster Trucks 2025 Potty Central Vs Really Gotta Go-Mainan,189900
Hot Wheels Monster Trucks Loop-And-Flip Trophy Challenge Playset,499900
Hot Wheels Skate Spiked Fury- Mainan Fingerboard,94410
Hot Wheels 1:43 2024 Mazda RX-8 Custom - Mainan Mobil Balap,159900
Matchbox Action Drivers Super Clean Car Wash Playset - Mainan Mobil,599900
Hot Wheels Skate Twist & Shred - Mainan Fingerboard,94410
Hot Wheels Monster Trucks Power Smashers Charge Playset - Mainan Mobil,949900
Hot Wheels City Super Police Station Playset - Mainan Trek Mobil Balap,499900
Hot Wheels Skate Purrformer - Mainan Fingerboard,94410
Matchbox Action Drivers Rescue Helicopter - Mainan Mobil Balap,519900
Hot Wheels Rapid Launch & Loop Playset - Mainan Trek Mobil Balap,519900
Hot Wheels 5 Cars Pack Netflix Let's Race - Mainan Mobil Balap,179900
Hotwheels Diecast Mystery Box,487700
Hot Wheels Premium Collector Vintage Race Team - Mainan Mobil Balap,503910
Hot Wheels Track Fleet Semi Rodger Dodger - Mainan Mobil Balap,124900
Hot Wheels Track Fleet Fuel and Fire - Mainan Mobil Balap,124900
Hot Wheels Track Fleet Rad Rider Rig - Mainan Mobil Balap,124900
Hot Wheels Skate Pain in The Neck - Mainan Fingerboard,94410
Hot Wheels Skate Booyah Boombox & Cool Cassette - Mainan Fingerboard,134910
Hot Wheels Skate 90's Rewind & Grind Multipack - Mainan Fingerboard,413910
Hot Wheels Skate Snake Strummer & Hot Stepper - Mainan Fingerboard,134910
Hot Wheels Skate Vert Van & Skate Vibin' - Mainan Fingerboard,134910
Hot Wheels Skate Boombox Skate Park Playset - Mainan Fingerboard,575920
Hot Wheels Skate Gnarly Gamer & High School Helix - Mainan Fingerboard,134910
Hot Wheels Monster Trucks Back to Basic Really Gotta-Go - Mainan Mobil,99900
Hot Wheels Monster Trucks Big Rigs HW 5 Alarm 2024- Mainan Mobil Balap,189900
Hot Wheels Monster Trucks Big Rigs Loco Punk 2024 - Mainan Mobil Balap,189900
Matchbox Hitch & Haul '61 Ford Ranchero & MBX Travel Trailer II-Mainan,139900
Matchbox Collectors Audi 100 Coupe S - Mainan Mobil Balap,139900
Matchbox Collectors 1932 Ford Model Roadster - Mainan Mobil Balap,139900
Hot Wheels Team Transport ´66 Porsche 906 Carrera 6 & Carry On - Mainan Mobil Balap,309900
Hot Wheels Team Transport '70 Plymouth AAR Cuda & Sakura Sprinter - Mainan Mobil Balap,309900
Hot Wheels Team Transport '66 Chevelle & '72 Chevy Ramp Truck - Mainan Mobil Balap,309900
Hot Wheels Audi S4 Quatro - Mainan Mobil Balap,129900
Matchbox Offroad Rally Ridge Raider - Mainan Mobil Anak,35900
Hot Wheels Turin Alfa Romeo GTV6 3.0 - Mainan Mobil Balap,129900
Hot Wheels Wolfsburg Volkswagen Golf MK7 - Mainan Mobil Balap,129900
Hot Wheels Volkswagen Brasilia Green Car - Mainan Mobil Balap,129900
Matchbox Offroad Rally 1976 Scoot 4x4 - Mainan Mobil Balap,35900
Hot Wheels Pop Culture Dash F Series Bundle,519600
Hot Wheels Team Transport Dash D Series Bundle,929700
Hot Wheels Car Culture Race Day Dash D Series Bundle,649500
Matchbox Aston Martin V8 Vantage 1977 - Mainan Mobil Balap,139900
Hot Wheels Speed Track Transporter Orange - Mainan Mobil Balap,299900
Hot Wheels Advent Calendar 2024 - Mainan Mobil Balap,419900
Hot Wheels Monster Trucks 1:64 Demolition Doubles 2-Pack (Carbonator HW Float Vs Bad Scoop),189900
Hot Wheels Monster Trucks Big Rigs Cage Rattler - Mainan Mobil Balap,189900
Hot Wheels Premium 2-Pack ´87 Ford Sierra Cosworth & ´93 Ford Escort RS Cosworth - Mainan Mobil Balap,239900
Hot Wheels Zamac 2024 5 Car Multipack - Mainan Mobil Balap,339900
Hot Wheels Premium Collector Set BRE Datsun Series - Mainan Mobil Balap,559900
Hot Wheels Germany Dash D Series Bundle,221400
Matchbox Moving Parts Dash P Series Bundle,299500
Hot Wheels Team Transport Dash C Series Bundle,929700
Hot Wheels 4-Loop Crash-Out Track Set - Mainan Trek Mobil Balap,899900
Hot Wheels Ultra Hots Blasting Launch Battle Playset - Mainan Trek Mobil Balap,719900
Hot Wheels Skate Tony Hawk Cereal Skate Bowl Fingerboard - Fingerboard,539900
Hot Wheels Ultimate Collector Case 6 Storages - Mainan Case Mobil Balap,124900
Hot Wheels European Style Multipack - Mainan Mobil Balap,339900
Hot Wheels Streets of Japan Multipack - Mainan Mobil Balap,339900
Hot Wheels Premium Greddy Diorama Set - Mainan Mobil Balap,559900
Hot Wheels Boulevard '67 Ford Anglia Racer - Mainan Mobil Balap,129900
Matchbox Moving Parts 1970 AMC Javelin - Mainan Mobil Balap,59900
Matchbox Europian Street 2019 Jeep Renegade - Mainan Mobil Balap,36900
Matchbox Europian Street Renault Kangoo - Mainan Mobil Balap,36900
Matchbox Moving Parts 2019 Ford Mustang Convertible - Mainan Mobil,59900
Matchbox Moving Parts GMC Hammer EV - Mainan Mobil Balap,59900
Hot Wheels Monster Trucks Big Rigs Rhinomite - Mainan Mobil Balap,189900
Hot Wheels Action Loop Cyclone Challenge Track Set - Mainan Trek Mobil,599900
Hot Wheels Fast Furious Dash F Series Bundle,649500
Matchbox Action Drivers Farm Adventure - Trek Mobil Balap,461930
Hot Wheels Skate Fingerboard Fiery Trickster - Mainan Fingerboard,94410
Matchbox Action Drivers Ferry Port Playset - Trek Mobil Balap,349900
Hot Wheels City Pizza Slam Cobra Attack Playset With 1:64 Scale ToyCar,539900
Hot Wheels Monster Trucks Arena Smashers MEGA-Wrex vs. Crushzilla,979930
Hot Wheels Skate Fingerboard Trashin' Tiger - Mainan Fingerboard,94410
Hot Wheels Premium Porsche Renschport 4 Mini Cars Collector Set,559900
Hot Wheels Big-air Bel-air Blue Car - Mainan Mobil Balap,129900
Hot Wheels Range Rover Classic - Mainan Mobil Balap,129900
Matchbox Action Drivers Tow & Repair Truck - Mainan Mobil Balap,419900
Hot Wheels Octopark Skate Set - Mainan Trek Fingerboard,854910
Hot Wheels Mosnter Trucks Color Reveal Surprise (Random) -Mainan Mobil,149900
Matchbox Collector 1944 Mitsubishi 3000GT - Mainan Mobil Balap,139900
Hot Wheels Team Transport '33 Willys & Speed Waze - Mainan Mobil Balap,309900
Hot Wheels BMW 3.0 CSL & BMW320 Group 5 - Mainan Mobil Balap,239900
Hot Wheels Action Whip Around Raceway - Mainan Trek Mobil Balap,499900
Hot Wheels Tunnel Twist Car Wash - Mainan Trek Mobil Balap,499900
Hot Wheels City Super Recharge Fuel Station - Mainan Trek Mobil Balap,499900
Hot Wheels City Bat Loop Attack - Mainan Trek Mobil Balap,349900
Matchbox Hitch & Haul Rapid Rescue & MBX Jet Ski and Trailer - Mainan,139900
Matchbox Hitch & Haul Road Strip King & Plowverizer - Mainan Mobil,139900
Hot Wheels Monster Trucks Big Rigs Tiger Shrek - Mainan Mobil Balap,189900
Hot Wheels Monster Trucks Big Bigs Bone Shaker - Mainan Mobil Balap,189900
Hot Wheels Monster Trucks Big Rigs Mega-Wrex - Mainan Mobil Balap,189900
Matchbox Skybuster CH-47 Chinook - Mainan Mobil Balap,64900
Matchbox Skybuster Air Grabber Orange - Mainan Mobil Balap,64900
Matchbox Skybuster Cesna Caravan - Mainan Mobil Balap,64900
Hot Wheels Monster Trucks Squidward Character - Mainan Mobil Anak,124900
Matchbox Japan Series J-15 Mazda MX-30 - Mainan Mobil Balap,59900
Matchbox Japan Series J-17 2020 Nissan Leaf - Mainan Mobil Balap,59900
Matchbox Moving Parts Nissan Ariya - Mainan Mobil Balap,59900
Matchbox Moving Parts Red 2024 Chevy Blazer EV - Mainan Mobil Balap,59900
Hot Wheels City Ultimate Garage Playset with 2 Die-Cast Cars,3599900
KAOS HOT WHEELS GENOXO TERAKOTA ORIGINAL STUND BRAND,139900
KAOS HOT WHEELS GENOXO T-SHIRT PUTIH THUNDERSHIFT,139900
KAOS HOT WHEELS GENOXO T-SHIRT NAVY STUNT ZONE,139900
KAOS HOT WHEELS GENOXO T-SHIRT KUNING THUNDERSHIFT 500,139900
Dadi Prima Binder Hot Wheels Blue,45000
Dadi Prima Backpack Hot Wheels with Red Cars 40 Cm,385000
Hot Wheels Neon Speeders Skyscraper Speed Circuit Track Set - Mainan,699900
Matchbox Working Rigs MBX Roads Scraptor - Mainan Mobil Balap,159900
Matchbox Moving Parts Blue 2020 Nissan Leaf - Mainan Mobil Balap,59900
Matchbox Moving Parts Silver Citroen e-C4 X - Mainan Mobil Balap,59900
Hot Wheels Neon Speeders Laser Stunt Slamway Playset-Mainan Trek Mobil,399900
Hot Wheels Mario Kart Series Shy Guy - Mainan Mobil Balap,124950
Hot Wheels Mario Kart Series Rosalina - Mainan Mobil Balap,124950
Hot Wheels Mario Kart Series Bowser Jr - Mainan Mobil Balap,124950
Hot Wheels Monster Trucks Arena Smashers Demo Derby Car Jump Challenge,619900
Hot Wheels Monster Trucks Arena Smashers Tigershark Spin-Out Challenge,619900
Hot Wheels City Super Loop Fire Station Playset - Mainan Trek Mobil,499900
Matchbox Working Rigs Western Star 49X - Mainan Mobil Balap,159900
Matchbox Working Rigs GMC T8500 - Mainan Mobil Balap,159900
Matchbox Action Drivers Fedex Package Center Playset - Mainan Trek,259900
Hot Wheels Action Vertical 8 Jump Track Set - Mainan Trek Mobil Balap,639900
Hot Wheels City T-Rex Loop And Stunt Playset - Mainan Trek Mobil Balap,539900
Hot Wheels Team Transport '80 Dodge Macho Power Wagon & Retro Rig,309900
Hot Wheels Monster Truck Bone Shaker Tire Press Challenge,359900
Hot Wheels Monster Trucks Tuk 'N Roll - Mainan Mobil Balap,99900
Hot Wheels Dino Launcher Playset - Mainan Trek Mobil Balap,119900
Hot Wheels Shark Launcher Playset - Mainan Trek Mobil Balap,119900
Hot Wheels City Transforming Race Tower Playset - Mainan Trek Mobil,659900
Hot Wheels Track Builder Straight Trackpack - Mainan Trek Mobil Balap,64900
Hot Wheels City Fuel Station Shift - Mainan Trek Mobil Balap,149900
Hot Wheels Skate Tony Hawk Taco Truck Playset -Mainan Trek Fingerboard,503910
Hot Wheels Skate Amusement Park Playset - Mainan Trek Fingerboard,647910
Hot Wheels 2023 Tony Hawk Arcade Skatepark Playset - Mainan Trek,377910
Matchbox Sky Busters Twin Engine Blaze Busters Yellow - Mainan Mobil,64900
Matchbox Sky Busters MBX Bubble Copter - Mainan Mobil Balap,45430
Matchbox Sky Busters Air Blade Blue - Mainan Mobil Balap,45430
Hot Wheels Team Transport Hydro Plane - Mainan Mobil Anak,309900
Hot Wheels Skate Tony Hawk Car and Fingerboard Pink Rapid Response,143910
Hot Wheels 2022 Tony Hawk Aquarium Skatepark with Exclusive Board,293930
Hot Wheels Mega Tower Car Wash - Mainan Trek Mobil Balap,949900
Matchbox Pizza Hut Pizza Run - Mainan Trek Mobil Balap,259900
Hot Wheels Mega Construx Building Set - Mainan Trek Mobil Balap,699900
Hot Wheels Mario Kart B-Dasher Wario - Mainan Mobil Balap,124950
Hot Wheels Mario Kart Lakitu Standar Kart - Mainan Mobil Balap,124950
Hot Wheels Monster Trucks Glow In The Dark Epic Loop Challenge Playset,599900
Hot Wheels Blister Protector Team Transport,31900
Matchbox Action Drivers Canyon Adventure - Mainan Trek Balap,461930
Hot Wheels City Downtown Express Car Wash Playset - Mainan Trek Mobil,249900
Hot Wheels City Downtown Repair Station Playset - Mainan Trek Mobil,249900
Hot Wheels City Super Twist Tire Shop - Mainan Trek Mobil Balap,499900
Hot Wheels City Roller Coaster Rally Playset - Mainan Trek Mobil Balap,799900
Hot Wheels Action Vertical Power Launch - Mainan Trek Mobil Balap,119900
Hot Wheels Matchbox Action Drivers Auto Shop - Mainan Trek Mobil Balap,349900
Hot Wheels Action Power Spin & Score - Mainan Trek Mobil Balap,119900
Hot Wheels City Scorpion Flex Attack - Mainan Trek Mobil Balap,349900
Hot Wheels Matchbox Dragon Slayer Petrol - Mainan Mobil Balap,207920
Hot Wheels Masters Of The Universe Boxed Set - Mainan Mobil Balap,413910
Hot Wheels Track Builder Unlimited Slide & Launch Pack - Mainan Trek,359900
Hot Wheels City Shark Chomp Transporter Playset - Mainan Trek Mobil,299900
Hot Wheels Speedway Hauler - Mainan Trek Mobil Balap,539900
Hot Wheels Mario Kart Yoshi - Mainan,124950
Hot Wheels Mario Kart Princess Peach - Mainan Mobil Balap,249900
Hot Wheels Matchbox 2013 Volvo V60 Station Wagon - Mainan Mobil Balap,139900
Hot Wheels Hill Climb Champion - Mainan Trek Mobil Balap,299900
Hot Wheels Matchbox Basic Car Assortment (Random) - Mainan Mobil Balap,35900
Hot Wheels Color Shifters (Random) - Mainan Mobil Balap,48720
Hot Wheels Matchbox 5-Car Pack - Mainan Mobil Balap,179900
Hot Wheels Double Loop Dash - Mainan Trek Mobil Balap,599900
Hot Wheels 10 Car pack - Mainan Mobil Balap,359900
Hot Wheels Mega Hauler - Mainan Mobil Balap,419900
Hot Wheels Classic Stunt Set 1 Mainan Anak,119900
Hot Wheels - 5 Cars Pack (Random),179900
[SPECIAL EDITION] - 50th Anniversary Hot Wheels,159900
Hot Wheels 3-Cars Pack (Random) - Mainan Mobil Anak,107900
Hot Wheels Monster Trucks 2025 Rhinomite - Mainan Mobil Balap,99900
Hot Wheels Monster Trucks 2025 HWMT Back to Basic Ramblin' Wrecker - Mainan Mobil Balap,99900
Hot Wheels Skate Boba Fett - Mainan Fingerboard,94410
Hot Wheels Monster Trucks 2025 Bone Shaker Vs Gunkster - Mainan Mobil,189900
Hot Wheels 1:43 Batmobile - Mainan Mobil Balap,159900
[SEGEL BOX SUDAH TERBUKA] Hot Wheels Basics Master Set - Mainan Mobil Balap,23099900
【Exclusive Launch】Hot Wheels Basic Master Set - Free 1 Collector Car,23099900
Hot Wheels Monster Trucks Oversized Metal Gotta Dump - Mainan Mobil,379900
Matchbox Sky Busters Sky Sentry Orange Plane - Mainan Mobil Balap,64900
Matchbox Sky Busters Boeing 747-8 - Mainan Mobil Balap,64900
Matchbox Sky Busters Boeing F/A 18-F Super Hornet - Mainan Mobil Balap,64900
Matchbox Hitch & Haul 1988 Jeep Wagoneer & MBX Pony Trailer - Mainan,139900
Hot Wheels Monster Trucks Dozen Delivery Snakc Pack - Mainan Mobil Balap,99900
Hot Wheels Monster Trucks Live HW 5 Alarm 2024 - Mainan Mobil Balap,99900
Hot Wheels Monster Trucks Pure Muscle Half Hazards 2024 - Mainan Mobil,99900
Hot Wheels Monster Trucks Trolls Poppy 2024 - Mainan Mobil Balap,99900
Hot Wheels Monster Trucks Leading Legend Bigfoot 2024 - Mainan Mobil,99900
Hot Wheels Monster Trucks Scratch Attack Beast Basher 2024 - Mainan,99900
Hot Wheels Monster Trucks Unimog Crash Legend 2024 -Mainan Mobil Balap,99900
Matchbox Action Drivers Transportration Center Playset - Mainan Trek,1099900
Hot Wheels Team Transport '70 Second Story Lorry & Fiat 131 Abarth - Mainan Mobil Balap,309900
Hot Wheels Toyota '82 Toyota Supra - Mainan Mobil Balap,129900
Matchbox Offroad Rally Green Jeep 4x4 Car - Mainan Mobil Anak,35900
Hot Wheels Pop Culture Dash E Series Bundle,649500
Hot Wheels Monster Trucks Glow In The Dark Bash Zilla Yellow Wheel,124900
Hot Wheels Monster Trucks Gotta Dump Mustard Car - Mainan Mobil Balap,42900
Hot Wheels Monster Trucks Strip Earned 2024 Piran-AHHHH - Mainan Mobil,99900
Hot Wheels Monster Trucks Too S'cool Mustard Car - Mainan Mobil Balap,42900
Hot Wheels Monster Trucks Glow In The Dark Haul Yall Orange Wheel,124900
Hot Wheels Monster Trucks Glow In The Dark Podium Crasher Lime Wheel,124900
Hot Wheels Monster Trucks HWMT Live 2024 Bone Shaker - Mainan Mobil,99900
Hot Wheels Monster Trucks Power Smasher 2024 Tiger Shark- Mainan Mobil,99900
Hot Wheels Monster Trucks Freestyle Wreckers 2024 Duck 'N Roll,99900
Hot Wheels Monster Trucks Snack Pack 2024 Carbonator - Mainan Mobil,99900
Hot Wheels Monster Trucks Freestyle Wreckers 2024 Barbie 65th Anniv,99900
Matchbox Mobil Ford COE tahun 1953 - Mainan Mobil Balap,139900
Hot Wheels Monster Trucks Crash Legends 2024 Nissan - Mainan Mobil,99900
Matchbox Mazda Savanna RX-3 1973 - Mainan Mobil Balap,139900
Hot Wheels Monster Trucks Power Smasher 2024 Demo Derby - Mainan Mobil,99900
Hot Wheels Monster Trucks 2024 Sneakerhead - Mainan Mobil Balap,99900
Hot Wheels Monster Trucks Power Smasher 2024 Blue 4x4x4 Big Foot,99900
Hot Wheels Monster Trucks Power Smasher 2024 Orange Tiger Shark,99900
Matchbox Ford Mustang Boss 302 tahun 1969 - Mainan Mobil Balap,139900
Hot Wheels Terra Trek Series Dash C Bundle,649500
Hot Wheels Premium 2-Pack ´05 Toyota Land Cruiser Prado & Mercedes Benz Sprinter Toure,239900
Hot Wheels Premium 2-Pack ´04 Mazda Speed Miata & Mazda RX7 FC Pandem - Mainan Mobil Balap,239900
Hot Wheels Batman Dash L Series Bundle,299500
Matchbox Offroad Rally Series Bundle,215400
Hot Wheels Slide Street Dash H Series Bundle,649500
Hot Wheels Monster Trucks SuperGirl DC 2024 Car - Mainan Mobil Balap,99900
Hot Wheels Monster Trucks Crash Legends Poison Pinto - Mainan Mobil,99900
Hot Wheels Monster Trucks Power Smashers Mega Wrex -Mainan Mobil Balap,99900
Hot Wheels Track Fleet Turbo Beast Golden Car - Mainan Mobil Balap,124900
Hot Wheels Monster Trucks Poison Pinto 2024 Car - Mainan Mobil Balap,99900
Hot Wheels Track Fleet Semi Rodger Dodger Red Car - Mainan Mobil Balap,124900
Hot Wheels Monster Trucks Live Gunkster Green Car - Mainan Mobil Balap,99900
Hot Wheels Monster Trucks 2024 Haul Yall - Mainan Mobil Balap,99900
Matchbox Candy Series Dash B Bundle,215400
Hot Wheels Premium Fash & Furious Dash G Series Bundle,649500
Hot Wheels Premium Boulevard Dash V Series Bundle,649500
Hot Wheels Team Transport Dash B Series Bundle,929700
Matchbox Moving Part Bizzarini 5300 GT Corsa - Mainan Mobil Balap,59900
Matchbox Moving Part Seagrave Fire-Truck - Mainan Mobil Balap,59900
Hot Wheels Monster Trucks 2024 Power Smashers Red Bone Shaker - Mainan Mobil Balap,99900
Hot Wheels Monster Trucks 2024 Glow In The Dark 5 Alarm - Mainan Mobil Balap,124900
Hot Wheels Monster Trucks 2024 Power Smashers Skelesaurus - Mainan Mobil Balap,99900
Hot Wheels Monster Trucks 2024 Nickleodeon Spongebob - Mainan Mobil Balap,99900
Hot Wheels Monster Trucks 2024 Power Smashers Orange Rhinomite - Mainan Mobil Balap,99900
Hot Wheels Monster Trucks 2024 Glow In The Dark Twinmill - Mainan Mobil Balap,124900
Hot Wheels Monster Trucks 2024 Camo Crashers Wreckreational - Mainan Mobil Balap,99900
Hot Wheels Monster Trucks 2024 HWMT Back To Basic Too S'cool - Mainan Mobil Balap,99900
Hot Wheels Monster Trucks 2024 Power Smashers Yellow Skelesaurus - Mainan Mobil Balap,99900
Hot Wheels Monster Trucks 2024 Glow In The Dark Hotweiller - Mainan Mobil Balap,124900
Hot Wheels Monster Trucks 2024 Mario Bros - Mainan Mobil Balap,99900
Hot Wheels Monster Trucks 2024 Power Smashers Green Gunkster - Mainan Mobil Balap,99900
Hot Wheels Monster Trucks 2024 Power Smashers Yellow 5-Alarm - Mainan Mobil Balap,99900
Matchbox Moving Part 1964 Buick Riviera - Mainan Mobil Balap,59900
Hot Wheels Monster Trucks 2024 Power Smashers Yellow Demo Derby - Mainan Mobil Balap,99900
Hot Wheels Monster Trucks 2024 Leading Legends Big Foot 4x4x4 - Mainan Mobil Balap,99900
Hot Wheels Monster Trucks 2024 Snack Pack Tuk 'N Roll - Mainan Mobil Balap,99900
Hot Wheels Boulevard '96 Honda Accord - Mainan Mobil Balap,129900
Hot Wheels Mario Kart Shy Guy Standart Kart - Mainan Mobil Balap,149900
Hot Wheels Mario Bros The Movie Koopa Troopa Character - Mainan Mobil,149900
Matchbox Germany 1962 Volkswagen Karmann Ghia - Mainan Mobil Balap,36900
Hot Wheels Mario Bros The Movie Toad Character - Mainan Mobil Balap,149900
Hot Wheels Boulevard '23 Nissan Z - Mainan Mobil Balap,129900
Matchbox Germany 2020 Audi TT RS - Mainan Mobil Balap,36900
Hot Wheels Boulevard Porsche 935 - Mainan Mobil Balap,129900
Matchbox Germany Mercedes-benz Unimog U300 - Mainan Mobil Balap,36900
Hot Wheels Boulevard '95 Toyota Celica GT-Four - Mainan Mobil Balap,129900
Hot Wheels Premium Pop Culture Dash B Series Bundle,519600
Matchbox Moving Parts 2019 Ford Ranger Grey Car - Mainan Mobil Balap,59900
Matchbox Moving Parts 2016 RAM Ambulance - Mainan Mobil Balap,59900
Matchbox Moving Parts 2020 Porsche 911 Carrera 4S Blue Car - Mainan Mobil Balap,59900
Matchbox Moving Parts 2020 Dodge Charger SRT Hellcat Yellow Car - Mainan Mobil,59900
Matchbox Conty Rescue Flame Tamer - Mainan Mobil Balap,35900
Matchbox Conty Rescue 1956 Buick Burner - Mainan Mobil Balap,35900
Matchbox Moving Parts 1978 Ford Bronco - Mainan Mobil Balap,59900
Matchbox Moving Parts 2022 Alfa Romeo Stelvio - Mainan Mobil Balap,59900
Matchbox Moving Parts 1965 Volkswagen 1600 TL Fastback - Mainan Mobil,59900
Matchbox DOTS Volkswagen Beetle 4x4 - Mainan Mobil Balap,35900
Matchbox Tootsie Roll 02 Humvee H2 SUV Concept - Mainan Mobil Balap,35900
Matchbox Europian Street Scania P360 - Mainan Mobil Balap,36900
Matchbox Sugar Daddy Ford GT 40 - Mainan Mobil Balap,35900
Matchbox Junior Mints Austin Mini Van - Mainan Mobil Balap,35900
Matchbox Europian Street BMW R1200RT-P - Mainan Mobil Balap,36900
Matchbox Moving Parts 2021 Ford Bronco - Mainan Mobil Balap,59900
Matchbox Europian Street Citroen Emi - Mainan Mobil Balap,36900
Matchbox Europian Street 2008 Lotus Evora - Mainan Mobil Balap,36900
Matchbox Moving Parts '24 Porsche 356A - Mainan Mobil Balap,59900
Matchbox Moving Parts Chevy Tahoe - Mainan Mobil Balap,59900
Matchbox Conty Rescue Chevy Caprice Classic Police -Mainan Mobil Balap,35900
Matchbox Moving Parts Tesla Model 3 - Mainan Mobil Balap,59900
Matchbox Conty Rescue Freightliner M2 106 - Mainan Mobil Balap,35900
Matchbox Conty Rescue '57 GMC Stepside - Mainan Mobil Balap,35900
Matchbox Moving Parts '24 2023 Audi RS G Avant - Mainan Mobil Balap,59900
Matchbox Moving Parts 1996 Mitsubishi Lancer Evolution IV - Mainan,59900
Matchbox Moving Parts '24 1973 BMW CSL 3.0 - Mainan Mobil Balap,59900
Matchbox Conty Rescue 2015 RAM 1500 - Mainan Mobil Balap,35900
Hot Wheels Monster Trucks Too S'cool Blue & White Car - Mainan Mobil,42900
Hot Wheels Monster Trucks Color Shifters Night Shifter Vehicle -Mainan,169900
Hot Wheels Monster Trucks Color Shifters Piran-AHHHH - Mainan Mobil,169900
Matchbox Germany Dash C Series Bundle,221400
Hot Wheels Premium 2-Packs Dash M Bundle,719700
Hot Wheels Premium 2-Pack Dash L Series Bundle,719700
Matchbox Japan Dash E Series Bundle,359400
Hot Wheels Car Culture Exotic Envy Dash G Series Bundle,649500
Matchbox Moving Parts Dash K Series Bundle,359400
Hot Wheels Monster Trucks The Flintstones - Mainan Mobil Balap,99900
Matchbox Action Drivers Police Traffic Center - Trek Mobil Balap,259900
Hot Wheels Monster Trucks Freestyle Wreckers Hi-tall Hauler - Mainan,99900
Hot Wheels Skate Skatebox 2-pack Orange - Mainan Fingerboard,220915
Hot Wheels Skate Skatebox 2-pack Yellow - Mainan Fingerboard,233910
Hot Wheels Skate Fingerboard Blue Raccoon Roll - Mainan Fingerboard,104900
Hot Wheels Skate Fingerboard Talon Shred - Mainan Fingerboard,104900
Hot Wheels Monster Trucks Freestyle Wreckers Gotta Dump - Mainan Mobil,99900
Matchbox Action Drivers Police Station Dispatch - Trek Mobil Balap,659900
Hot Wheels Monster Trucks HWMT Back To Basic Totaled - Mainan Mobil,99900
Hot Wheels Skate Fingerboard Wingstorm - Mainan Fingerboard,94410
Hot Wheels Skate Fingerboard Percepcition Deception - Mainan,94410
Hot Wheels Monster Trucks 2024 Orange Bigfoot - Mainan Mobil Balap,99900
Hot Wheels Monster Trucks Stripes Earned - Mainan Mobil Balap,99900
Hot Wheels Monster Trucks Glow In The Dark Green Scorpedo - Mainan,124900
Hot Wheels Skate Fingerboard Hoverboard - Mainan Fingerboard,104900
Hot Wheels Skate Fingerboard Flame Thrower - Mainan Fingerboard,104900
Hot Wheels Skate Fingerboard Moon Howler - Mainan Fingerboard,104900
Hot Wheels Monster Trucks Glow In The Dark Orange Bone Shaker - Mainan,124900
Hot Wheels Monster Trucks Glow In The Dark Pink Shark Wreck - Mainan,124900
Hot Wheels Skate Fingerboard Can't Beehive - Mainan Fingerboard,104900
Hot Wheels Skate Fingerboard Gummy Grinder - Mainan Fingerboard,104900
Hot Wheels Skate Fingerboard Tricked Out Trike - Mainan Fingerboard,94410
Hot Wheels Monster Trucks Glow In The Dark Blue Loco Punk - Mainan,124900
Hot Wheels Monster Trucks Treasure Chomp Challenge - Trek Mobil Balap,359900
Hot Wheels Monster Trucks Glow In The Dark Orange 4x4x4 Bigfoot-Mainan,124900
Matchbox Moving Parts Dash L Series Bundle,359400
Matchbox Candy Series Dash A Bundle,215400
Matchbox Austin Mini Van 1965 - Mainan Mobil Balap,35900
Hot Wheels 2005 Toyota Land Cruisser Prado - Mainan Mobil Balap,129900
Hot Wheels 2018 Toyota 4Runner - Mainan Mobil Balap,129900
Matchbox 1964 Austin Mini Cooper White - Mainan Mobil Balap,35900
Matchbox 2011 Mini Countryman - Mainan Mobil Balap,35900
Hot Wheels 1993 Mercedes-benz G-Class - Mainan Mobil Balap,129900
Matchbox 2003 Mini Cooper S - Mainan Mobil Balap,35900
Matchbox 1964 Austin Mini Cooper - Mainan Mobil Balap,35900
Matchbox 2010 Mini Cooper's Cabrio - Mainan Mobil Balap,35900
Hot Wheels Boulevard Dash U Series Bundle,649500
Hot Wheels Monster Trucks 2024 Rhinomite Camo Crashers - Mainan Mobil,99900
Hot Wheels Monster Trucks 2024 Mega Wrex HWMT Live -Mainan Mobil Balap,99900
Hot Wheels Monster Trucks 2024 Scorpedo Beast Bashers - Mainan Mobil,99900
Hot Wheels Monster Trucks 2024 Crate Danger - Mainan Mobil Balap,99900
Hot Wheels Monster Trucks 2024 Dodge RAM Van - Mainan Mobil Balap,99900
