product_name,product_price_rp
Hot Wheels Monster Trucks 2024 Samson - Mainan Mobil Balap,99900
Hot Wheels Monster Trucks 2024 Motosaurus - Mainan Mobil Balap,99900
Hot Wheels Monster Trucks Carbonator Green - Mainan Mobil Balap,42900
Hot Wheels Track Builder Toxic Super Jump - Mainan Trek Mobil,359900
Hot Wheels Monster Trucks HW Race Ace Blue - Mainan Mobil Balap,42900
Hot Wheels Monster Trucks Lava Shark Black - Mainan Mobil Balap,42900
Hot Wheels Monster Trucks Will Trash It All Orange -Mainan Mobil Balap,42900
Hot Wheels Tony Hawk HQ Skatepark Set - Mainan Trek Fingerboard,431910
Matchbox Europian Street Dash B Series Bundle,221400
Hot Wheels Fast & Furious Dash E Series Bundle,649500
Hot Wheels Premium Super Street Dash K Series Bundle,719700
Gift Card Hot Wheels Happy Birthday (No Custom),5000
Hot Wheels Monster Trucks Big Foot 4x4x4 Freestyle Wreckers - Mainan,99900
Hot Wheels Monster Trucks Scratch Attack - Mainan Mobil Balap,99900
Matchbox Collector 2018 Bugatti Divo - Mainan Mobil Balap,139900
Matchbox Collector 1955 Ford Panel Delivery - Mainan Mobil Balap,139900
Hot Wheels Monster Trucks Pizza.co Snack Pack - Mainan Mobil Balap,99900
Matchbox Collector 2022 Lexus LX - Mainan Mobil Balap,139900
Matchbox Collector 2023 Nissan Z White - Mainan Mobil Balap,139900
Hot Wheels Monster Trucks Godzilla with Metal Body - Mainan Mobil,99900
Hot Wheels Monster Trucks Unimog Crash Legends 2024 - Mainan Mobil,99900
Hot Wheels Monster Trucks Demolition Double Oscar Mayer Vs All Fried,189900
Hot Wheels Monster Trucks Demolition Double DarthVader Vs Stormtrooper,189900
Hot Wheels Monster Trucks Demolition Double Haul Yall Vs Rodger Dodger,189900
Hot Wheels Monster Trucks Demolition Double Duck 'N Roll Vs Piran-Ahh,189900
Hot Wheels Monster Trucks Tiger Shark HWMT Live - Mainan Mobil Balap,99900
Hot Wheels Monster Trucks Camo Crashers 2024 - Mainan Mobil Balap,99900
Hot Wheels Car Culture Dash G Chase Car Series Bundle,649500
Matchbox Moving  Parts Dash J 2023 Series Bundle,419300
Hot Wheels Neon Speeders Rally Cat - Mainan Mobil Balap,59900
Hot Wheels Holden Monaro & Holden Torana - Mainan Mobil Balap,239900
Hot Wheels Neon Speeders '99 Honda Civic Type R (EK9) - Mainan Mobil,59900
Hot Wheels Team Transport '97 Mercedes-benz & Fleet Street - Mainan,309900
Hot Wheels Neon Speeders 2017 Nissan GT-R (R35) - Mainan Mobil Balap,59900
Hot Wheels Neon Speeders GT Hunter - Mainan Mobil Balap,59900
Hot Wheels Mitsubishi Lancer & '95 Mitsubishi Eclipse - Mainan Mobil,239900
Hot Wheels Neon Speeders SRT Viper GTS-R - Mainan Mobil Balap,59900
Hot Wheels Team Transport Porsche 959 & Euro Hauler - Mainan Mobil,309900
Hot Wheels Neon Speeders Volkswagen Golf MK-7 - Mainan Mobil Balap,59900
Hot Wheels Modern Classics Fiat 131 Abarth - Mainan Mobil Balap,129900
Hot Wheels Boulevard Porsche 911 Turbo (930) - Mainan Mobil Balap,129900
Hot Wheels Boulevard Mercedes-Benz 190 E - Mainan Mobil Balap,129900
Hot Wheels Modern Classics Honda Civic EG - Mainan Mobil Balap,129900
Hot Wheels Boulevard 70 Dodge Hemi Challenger - Mainan Mobil Balap,129900
Hot Wheels Modern Classics Volkswagen Corrado VR6 - Mainan Mobil Balap,129900
Hot Wheels Modern Classics 98 Toyota Altezza - Mainan Mobil Balap,129900
Hot Wheels Boulevard Audi S4 quattro - Mainan Mobil Balap,129900
Hot Wheels Boulevard Nissan Silvia S15 NISMO - Mainan Mobil Balap,129900
Hot Wheels Modern Classics 91 Mazda MX5 Miata - Mainan Mobil Balap,129900
Dadi Stationery Set Hot Wheels Car Tengkorak 5pcs,32500
Matchbox Germany Dash A Series Bundle,221400
Hot Wheels Skate Root Canal - Mainan Fingerboard,94410
Hot Wheels Monster Trucks Roarin' Wreckers - Mainan Mobil Balap,199900
Hot Wheels Skate Boba Feet - Mainan Fingerboard,104900
Hot Wheels Skate Mysterious Moon - Mainan Fingerboard,104900
Hot Wheels Monster Trucks Arena Smasher Rhinomite Chargin' Challenge,439900
Hot Wheels Skate TMNT Donatello - Mainan Fingerboard,112410
Hot Wheels Skate TMNT Leonardo - Mainan Fingerboard,124900
Hot Wheels Skate TMNT Michelangelo - Mainan Fingerboard,124900
Hot Wheels Skate TMNT Raphael - Mainan Fingerboard,124900
Hot Wheels Monster Trucks Stunt Tire - Mainan Trek Mobil Balap,739900
Matchbox Hitch & Haul Hazard Squad & MBX Mobile Light Truck - Mainan,139900
Matchbox Hitch & Haul Road Distroyer & MBX Farm Trailer - Mainan Mobil,139900
Hot Wheels Monster Trucks Twisted Treedz - Mainan Mobil Balap,279900
Hot Wheels City Downtown Ice Cream Swirl Pink -Mainan Trek Mobil Balap,249900
Hot Wheels Monster Trucks Big Bigs The 909 - Mainan Mobil Balap,189900
Hot Wheels Monster Trucks More Neonsense Hot Wheeler - Mainan Mobil,99900
Hot Wheels 1:43 Corvette CB.R - Mainan Mobil Balap,159900
Hot Wheels 1:43 2022 Camaro ZL1 - Mainan Mobil Balap,159900
Hot Wheels 1:43 Alpha Pursuit - Mainan Mobil Balap,159900
Hot Wheels 1:43 Twin Mill - Mainan Mobil Balap,159900
Hot Wheels 1:43 Heavy Hitcher - Mainan Mobil Balap,159900
Hot Wheels 1:43 Bone Shaker Red Car - Mainan Mobil Balap,159900
Hot Wheels 1:43 Lancer Evolution IX - Mainan Mobil Balap,159900
Hot Wheels 1:43 GT-Scorcher - Mainan Mobil Balap,159900
Hot Wheels 1:43 GMC Hummer EV - Mainan Mobil Balap,159900
Hot Wheels 1:43 Porsche 911 GT3 - Mainan Mobil Balap,159900
Matchbox Skybuster Indiana Jones River Flyer - Mainan Mobil Balap,64900
Matchbox Skybuster Boeing 747-400 - Mainan Mobil Balap,64900
Matchbox Skybuster Space-X Falcon Heavy - Mainan Mobil Balap,64900
Matchbox Skybuster MBX 6-2 Airliner - Mainan Mobil Balap,64900
Matchbox Skybuster F-35 (B) Lightning - Mainan Mobil Balap,64900
Hot Wheels Mario Kart Circuit Slam Playset - Mainan Trek Mobil,799900
Hot Wheels Skate Ghoulish Delight - Mainan Fingerboard,104900
Hot Wheels Skate Power Chomp - Mainan Fingerboard,104900
Hot Wheels Skate Teenage Mutant Ninja Turtle - Mainan Fingerboard,104900
Hot Wheels Skate Pink Metalic Finish with Car - Mainan Fingerboard,143910
Hot Wheels Skate Stacked Dominance - Mainan Fingerboard,104900
Hot Wheels Skate Pink Green Metalic Finish with Car - Mainan,143910
Hot Wheels 55 Series Porsche 993 GT2 - Mainan Mobil Balap,59900
Hot Wheels 55 Series Custom '01 Acura Integra GSR - Mainan Mobil Balap,59900
Hot Wheels 55 Series Twin Mill - Mainan Mobil Balap,59900
Hot Wheels 55 Series Mercedes Benz Unimog U 1300 L -Mainan Mobil Balap,59900
Hot Wheels 55 Series '67 Camaro - Mainan Mobil Balap,59900
Hot Wheels 1:43 Lolux Green Car - Mainan Mobil Balap,159900
Hot Wheels 55 Series '67 Chevy C10 - Mainan Mobil Balap,59900
Hot Wheels Compact Case with 3 Extra Feature Showcase (Random),69900
Hot Wheels Basic Car Short Card (Random) - Mainan Mobil Balap,35900
"Dadi Prima Hot Wheels ""Bash Crash"" Ransel Anak",398000
Hot Wheels Premium Collectors Garage Dash Q - Mainan Mobil Balap,559900
Hot Wheels Premium Collectors Jay Leno's Garage - Mainan Mobil Balap,559900
Hot Wheels Team Transport Dash W Series Bundle,929700
Hot Wheels Mario kart Dash F Series Bundle,1049300
Hot Wheels Bundle 2 Pack Dash J Series Bundle,719700
Hot Wheels Car Culture Dash G Series Bundle,649500
Hot Wheels Boulevard Dash T Series Bundle,649500
Hot Wheels Diecast Mania 2023,559600
Matchbox Diecast Mania 2023,183600
Matchbox Working Rigs Man Blue TGS MCAB - Mainan Mobil Balap,159900
Hot Wheels Monster Trucks 2023 Bear Devil Black Car - Mainan Mobil,99900
Hot Wheels Monster Trucks Gunkster - Mainan Mobil Balap,99900
Hot Wheels Basic Cyberrig Yellow - Mainan Mobil Balap,124900
Hot Wheels Monster Trucks 5 Alarm HWMT Live - Mainan Mobil Balap,99900
Matchbox Working Rigs International MV Box Truck - Mainan Mobil Balap,159900
Hot Wheels Monster Trucks HW Pizza Co - Mainan Mobil Balap,99900
Hot Wheels Monster Trucks Race Ace HWMT Back to Basic - Mainan Mobil,99900
Hot Wheels Monster Trucks Patrick Character - Mainan Mobil Anak,124900
Hot Wheels Monster Trucks Mr. Crab Character - Mainan Mobil Anak,124900
Hot Wheels Monster Trucks Hot Wheeler Beast Basher -Mainan Mobil Balap,99900
Hot Wheels Monster Trucks Rodger Dodger 24 - Mainan Mobil Balap,99900
Matchbox Working Rigs MBJ Crop Sprayer - Mainan Mobil Balap,159900
Hot Wheels Monster Trucks 2023 Snake Bite Leading Legends - Mainan,99900
Hot Wheels Monster Trucks Plankton Character - Mainan Mobil Anak,124900
Hot Wheels Monster Trucks Meyers Manx - Mainan Mobil Balap,99900
Hot Wheels Monster Trucks Oscar Mayer Snack Pack - Mainan Mobil Balap,99900
Hot Wheels Basic Firehouse Fueler - Mainan Mobil Balap,124900
Hot Wheels Monster Trucks Crush Delivery Beast Bashers - Mainan Mobil,99900
Hot Wheels Monster Trucks Spongebob Squarepants Character - Mainan,124900
Hot Wheels Monster Trucks 2023 Board To Be Wild - Mainan Mobil Balap,99900
Hot Wheels Basic Rad Rider Rig Red - Mainan Mobil Balap,124900
Hot Wheels Monster Trucks Star Wars The Mandalorian - Mainan Mobil,99900
Hot Wheels Monster Trucks Night Shifter HWMT Back to Basic - Mainan,99900
Hot Wheels Monster Trucks 2024 Star War Imperial Shock Trooper,99900
Hot Wheels Monster Trucks Demolition Doubles HW Safari Vs Wild Streak,189900
Hot Wheels Monster Trucks 5 Alarm Red Car - Mainan Mobil Balap,42900
Hot Wheels Monster Trucks CLiff Starbird Monstervette - Mainan Mobil,99900
Hot Wheels Monster Trucks 2023 Volkswagen Battle - Mainan Mobil Balap,99900
Hot Wheels Monster Trucks 2024 Cage Rattler - Mainan Mobil Balap,99900
Hot Wheels Monster Trucks Invader Camo Crusher - Mainan Mobil Balap,99900
Hot Wheels Monster Trucks Trolls Poppy Character - Mainan Mobil Balap,99900
Hot Wheels Monster Trucks The 909 Orange Car - Mainan Mobil Balap,42900
Hot Wheels Monster Trucks Live Bone Shaker Red - Mainan Mobil Balap,99900
Hot Wheels Monster Trucks Bone Shaker Red Car - Mainan Mobil Balap,42900
Hot Wheels Monster Trucks 2023 Back To The Future : Time Machine,99900
Hot Wheels Monster Trucks HW Demo Derby Red & Yellow Car -Mainan Mobil,42900
Hot Wheels Monster Trucks 2024 Duck N Rolls - Mainan Mobil Balap,99900
Hot Wheels Monster Trucks Demolition '24 Night Shifter Vs 5 Alarms,189900
Hot Wheels Monster Trucks HW Trash It All Yellow Car - Mainan Mobil,42900
Hot Wheels Monster Trucks Demolition Doubles Bogfoot 4x4x4 Vs Samson,189900
Hot Wheels Monster Trucks Demolition '56 Hi-tail Hauler Vs Silverado,189900
Matchbox Working Rigs MBX Road Grader - Mainan Mobil Balap,159900
Hot Wheels Monster Trucks Gunkster Green Car - Mainan Mobil Balap,42900
Matchbox Germany 1962 Volkswagen Beetle Red - Mainan Mobil Balap,36900
Hot Wheels Forza Alfa Romeo 8C Competizione - Mainan Mobil Balap,59900
Matchbox Mercedes-Benz W 123 Blue - Mainan Mobil Balap,36900
Matchbox Renault Kongo Orange - Mainan Mobil Balap,36900
Matchbox Japan Series J-19 1975 Mitsubishi Lancer Celeste - Mainan,59900
Matchbox Porsche 911 Carerra Cabriolet - Mainan Mobil Balap,36900
Matchbox Japan Series J-16 1988 Mazda RX-7 - Mainan Mobil Balap,59900
Hot Wheels Spettacolare Series Alfa Romeo Giulia Sprint GTA - Mainan,129900
Mathcbox Japan Series J-18 2020 Lexus LX - Mainan Mobil Balap,59900
Hot Wheels Spettacolare Series Alfa Romeo 155 V6 TI - Mainan Mobil,129900
Hot Wheels Spettacolare Series Lancia Stratos - Mainan Mobil Balap,129900
Matchbox Japan Series J-14 1990 Toyota MR2 W20 - Mainan Mobil Balap,59900
Matchbox Mercedes-AMG GT 63 S White - Mainan Mobil Balap,36900
Matchbox Mercedes Benz 550 Purple - Mainan Mobil Balap,36900
Matchbox Moving Parts Blue 1994 Mitsubishi Lancer Evolution IV,59900
Matchbox Moving Parts White 2020 Ram Rebel - Mainan Mobil Balap,59900
Matchbox Moving Parts Grey 1964 Chevy C10 Pickup - Mainan Mobil Balap,59900
Matchbox Moving Parts Silver Seagrave Fire Truck - Mainan Mobil Balap,59900
Matchbox Sky Busters Indiana Jones Series River Flyer - Mainan Mobil,64900
Matchbox Sky Busters Space-X Dragon - Mainan Mobil Balap,64900
Matchbox Moving Parts 2020 Chevy Tahoe - Mainan Mobil Anak,59900
Matchbox Sky Busters Indiana Jones Series MBX Airliner - Mainan Mobil,64900
Hot Wheels City Ultimate T-Rex Transporter Playset -Mainan Mobil Balap,1999900
Matchbox Sky Busters Gray Air Blade - Mainan Mobil Balap,64900
Matchbox Sky Busters Boeing 747-400 - Mainan Mobil Balap,64900
Matchbox Sky Busters Space-X Starship - Mainan Mobil Balap,64900
Matchbox Moving Parts Black Bolinger B2 - Mainan Mobil Balap,59900
Hot Wheels Skate Tony Hawk Green Sky Shredder - Mainan Fingerboard,104900
Hot Wheels Skate Tony Hawk Yellow Draggin' Bones - Mainan Fingerboard,104900
Hot Wheels Skate Tony Hawk Pink Vertibird SK8 - Mainan Fingerboard,104900
Hot Wheels Monster Trucks 2023 Beast Basher Cage Rattler - Mainan,99900
Hot Wheels Monster Trucks 2023 Champion Crashers Bomb Shaker,99900
Hot Wheels Monster Trucks Roarin' Wreckers Bigfoot 4x4x4 - Mainan,199900
Hot Wheels Monster Trucks 2023 Champion Crashers Demo Derby,99900
Hot Wheels Monster Trucks 2023 Batman Classic TV Series - Mainan Mobil,99900
Hot Wheels Monster Trucks 2023 Freestyle Wreckers Dodge Charget R/T440,99900
Hot Wheels Monster Trucks Snack Pack Nacho Mammas - Mainan Mobil Balap,99900
Hot Wheels Monster Trucks Star Wars Battle Damaged StromTrooper,99900
Hot Wheels Monster Trucks 2023 Back to Basic HW Delivery,99900
Hot Wheels Monster Trucks 2023 Blue Nissan - Mainan Mobil Balap,99900
Hot Wheels Monster Trucks 2023 Leading Legends Electric Bigfoot,99900
Hot Wheels Monster Trucks Crash Legends Meyers Manx - Mainan Mobil,99900
Hot Wheels Skate Tony Hawk Blue Sky Shock - Mainan Fingerboard,104900
Hot Wheels Fast and Furious Dash D Bundle Series,649500
KAOS HOT WHEELS GENOXO T-SHIRT ABU TUA LOGO HOT WHEELS,139900
Hot Wheels Premium Retro Entertainment Series Bundle,649500
Dadi Prima Activity Book Hot Wheels,18500
Dadi Prima Pencil case Hot Wheels 1 Zipper,85000
Dadi Prima Backpack Hot Wheels Blue 32 Cm,390000
Dadi Prima Binder Hot Wheels Black,45000
Dadi Prima Pencil case Hot Wheels 2 Zipper,97000
Dadi Prima Backpack Hot Wheels Black 32 CM,375000
Dadi Prima Backpack Hot Wheels 40 Cm,398000
Dadi Prima Stationery Set Hot Wheels Series 1,32500
Dadi Prima Pencil Case Hot Wheels Blue 2 Zipper,97000
Hot Wheels Premium Fast & Furious Dash L Series Bundle,649500
Hot Wheels Action Triple Loop Kit - Mainan Trek Mobil Balap,779900
Hot Wheels Fast & Furious Dash C Series Bundle,649500
Hot Wheels Car Culture Dash C Series Bundle,649500
Hot Wheels Race Day Dash D Series Bundle,649500
Hot Wheels Mario Kart Series Princess Daisy - Mainan Mobil Balap,249900
Hot Wheels Basic Cars dash L 2023 - Mainan Mobil Balap,1899900
Hot Wheels 1:43 Night Shifter (Blue) with Orange Wheels - Mainan Mobil,59900
Matchbox Convoy Tesla Semi MBX Pipe Trailer & MBX Load Lifter - Mainan,207920
Hot Wheels Monster Trucks Glow In The Dark Carbonator XXL Purple,124900
Matchbox Convoy Western Star 49X & 2019 Ford Mustang Coupe - Mainan,259900
Hot Wheels 1:43 Solid Muscles (Red) - Mainan Mobil Balap,59900
Matchbox Moving Parts Bentley Continental Black - Mainan Mobil Balap,59900
Hot Wheels Monster Trucks Demolition Double HW Safari Vs Wild Streak,189900
Hot Wheels Monster Trucks Demolition Double Dodge Charger Vs Rodger,189900
Matchbox Working Rigs International Box Trucks Caution Fourgon -Mainan,159900
Hot Wheels Team Transport '61 Impala & Chevy Ramp Truck - Mainan Mobil,309900
Hot Wheels Team Transport Alfa Romeo 155 V6 T & Fleet Flyer - Mainan,309900
Hot Wheels Team Transport '70 Rover P6 Group & HW Rally Hauler -Mainan,309900
Hot Wheels Monster Trucks Demolition Double Haul Y'all Vs HW Taxi,189900
Matchbox Moving Parts Yellow 2023 Nissan Z - Mainan Mobil Balap,59900
Hot Wheels Team Transport Porsche 934.5 & Fleet Street - Mainan Mobil,279900
Matchbox Moving Parts Red Toyota FJ Cruisser - Mainan Mobil Balap,59900
Matchbox Moving Parts Red Tesla Model 3 - Mainan Mobil Balap,59900
Matchbox Moving Parts White 2022 Lexus LX - Mainan Mobil Balap,59900
Matchbox Moving Parts Mercedes-Benz Sprinter - Mainan Mobil Balap,59900
Matchbox Moving Parts White 1961 Jeep FC - Mainan Mobil Balap,59900
Hot Wheels Boulevard '93 Ford Escort RS Cosworth - Mainan Mobil Balap,129900
Matchbox Muscle 2018 Dodge Charger - Mainan Mobil Balap,35900
Matchbox Muscle 1965 Ford Mustang GT - Mainan Mobil Balap,35900
Hot Wheels Boulevard '96 Chevy Impala SS - Mainan Mobil Balap,129900
Matchbox Muscle 2019 Ford Mustang Coupe - Mainan Mobil Balap,35900
Matchbox Muscle 2020 Convertte C8 - Mainan Mobil Balap,35900
Hot Wheels Boulevard '04 Mazda Mazdaspeed Miata - Mainan Mobil Balap,129900
Matchbox Muscle 1969 Camaro SS 396 Convertible - Mainan Mobil Balap,35900
Hot Wheels Boulevard Volkswagen T1 Panel Bus - Mainan Mobil Balap,129900
Matchbox Muscle 1970 PLymouth Cuda - Mainan Mobil Balap,35900
Hot Wheels Mario Kart Series Yellow Bowser - Mainan Mobil Balap,149900
Matchbox Moving Parts 1950 Chevy Suburban Dark Green - Mainan Mobil,59900
Hot Wheels Ultra Hots Chevy Chevelle SS Blue - Mainan Mobil Balap,59900
Hot Wheels Ultra Hots Custom '69 Volkswagen Squareback - Mainan Mobil,59900
Hot Wheels Ultra Hots '73 Ford Falcon XB - Mainan Mobil Balap,59900
Hot Wheels Ultra Hots '71 Plymouth Road Runner Gold-Mainan Mobil Balap,59900
Matchbox Moving Parts 2019 Ford Mustang Convertible-Mainan Mobil Balap,59900
Hot Wheels Ultra Hots Nissan Fairi Ary- Z Green - Mainan Mobil Balap,59900
Hot Wheels Ultra Hots '68 Plymouth Barracuda Formula S - Mainan Mobil,59900
Hot Wheels Ultra Hots Porsche 934.5 Red - Mainan Mobil Balap,59900
Matchbox Moving Parts 1980 Mercedes-Benz 450 SEL - Mainan Mobil Balap,59900
Matchbox Moving Parts Jeep Gladiator - Mainan Mobil Balap,59900
Matchbox Moving Parts 1983 Buick Riviera - Mainan Mobil Balap,59900
Hot Wheels Ultra Hots '71 Dodge Demon Red - Mainan Mobil Balap,59900
Matchbox Moving Parts 2021 Ford Bronco Blue - Mainan Mobil Balap,59900
Matchbox Moving Parts 1988 Mazda X-7 White - Mainan Mobil Balap,59900
Matchbox Moving Parts 1957 Ford Country Sedan - Mainan Mobil Balap,59900
Matchbox Germany Series Dash F Series Bundle,221400
[Indonesia Special Edition] Hot Wheels Action 5 Cars Pack - Mainan,169900
Hot Wheels Monster Trucks 2023 Freestyle Wreckers Bigfoot - Mainan,99900
Hot Wheels Monster Trucks 2023 Golden Shark Wreak - Mainan Mobil Balap,99900
Matchbox Working Rigs Garbage King XL Green - Mainan Mobil Balap,159900
Hot Wheels Premium Set Collector Nissan Skyline - Mainan Mobil Balap,559900
Hot Wheels Spettacolare Series Dash B Bundle,649500
Matchbox Muscle Series Dash V Bundle,215400
Matchbox Moving Parts 2019 RAM Ambulance - Mainan Mobil Balap,59900
Matchbox Moving Parts Blue 1978 Subaru Brat - Mainan Mobil Balap,59900
Matchbox Moving Parts Mercedes-Benz Unimog U5023 - Mainan Mobil Balap,59900
Matchbox Moving Parts 2021 Fiat 500E - Mainan Mobil Balap,59900
Matchbox Moving Parts 1995 Volkswagen Golf MK - Mainan Mobil Balap,59900
Hot Wheels Fast & Furious Premium 1971 Plymouth GTX - Mainan Mobil,129900
Hot Wheels Fast & Furious Premium Toyota Land Cruisser FJ60 - Mainan,129900
Hot Wheels Fast & Furious Premium Dodge Charger SRT Hellcat Widebody,129900
Hot Wheels Fast & Furious Premium 1969 Blue Chevy Camaro -Mainan Mobil,129900
Hot Wheels Fast & Furious Premium W Motor Lykan HyperSport - Mainan,129900
Matchbox Sky Busters MBX Crop Duster Red - Mainan Mobil Balap,64900
Hot Wheels Monster Trucks Mutant Ninja Turtles Blue Leonardo - Mainan,124900
Hot Wheels Monster Trucks Mutant Ninja Turtles Red Raphael - Mainan,124900
Hot Wheels Monster Trucks Shark Wreak - Mainan Mobil Balap,99900
Hot Wheels Monster Trucks Mutant Ninja Turtles Orange Michelangelo,124900
Matchbox Sky Busters Cessna Citation X - Mainan Mobil Balap,64900
Hot Wheels Monster Trucks Tri To Crush Me (Back to Basic) - Mainan,99900
Hot Wheels Mario Kart Green Baby Luigi - Mainan Mobil Balap,149900
Matchbox Sky Busters Sky Scorcher - Mainan Mobil Balap,64900
Matchbox Sky Busters MBX Pusher Prop - Mainan Mobil Balap,64900
Matchbox Sky Busters Sky Sentry - Mainan Mobil Balap,64900
Hot Wheels Monster Trucks Mutant Ninja Turtles Purple Donatello,124900
Matchbox 70th Anniversary RAM Ambulance 70 - Mainan Mobil Balap,59900
Hot Wheels Premium Speed Machines McLaren 720S Orange - Mainan Mobil,129900
Matchbox 70th Anniversary 2022 Hummer EV - Mainan Mobil Balap,59900
Hot Wheels Premium Speed Machines Pagini Zonda R - Mainan Mobil Balap,129900
Hot Wheels Premium Speed Machines Lambhorgini Veneno Red -Mainan Mobil,129900
Hot Wheels Premium Speed Machines Ford GT White - Mainan Mobil Balap,129900
Hot Wheels Premium Speed Machines Porsche 911 GT3 Blue - Mainan Mobil,129900
Matchbox 70th Anniversary Mazda MX-30 - Mainan Mobil Balap,59900
Matchbox 70th Anniversary 2020 Corvette C8 - Mainan Mobil Balap,59900
Matchbox 70th Anniversary 1980 Porsche 911 - Mainan Mobil Balap,59900
Hot Wheels Japan Series '90 Acura NSX Silver - Mainan Mobil Balap,59900
Hot Wheels Japan Series '91 Mazda MX-5 Miata Blue - Mainan Mobil Balap,59900
Matchbox Japan Series C 1994 Mitsubishi Lancer Evolution IV - Mainan,59900
Hot Wheels Japan Series Toyota 2000 GT Yellow - Mainan Mobil Balap,59900
Matchbox Japan Series C Datsun 280 ZX - Mainan Mobil Balap,59900
Matchbox Japan Series C 2004 Honda S 2000 - Mainan Mobil Balap,59900
Hot Wheels Japan Series Fairlady 2000 Black - Mainan Mobil Balap,59900
Matchbox Japan Series C Toyota FJ40 - Mainan Mobil Balap,59900
Hot Wheels Japan Series '98 Honda Prelude - Mainan Mobil Balap,59900
Matchbox Japan Series C Toyota FJ Cruiser - Mainan Mobil Balap,59900
Matchbox Japan Series C Mazda MX-30 - Mainan Mobil Balap,59900
Hot Wheels Premium 2-Pack Plymouth Belvedere 426 Wedge & '65 Dodge,239900
Hot Wheels Premium 2-Pack Pandem Subaru BRZ & Lexus RC F GT3 - Mainan,239900
Hot Wheels Fast & Furious Dash B Series Bundle,649500
Matchbox Moving Parts 1975 Mitsubishi Lancer Celeste - Mainan Mobil,59900
Matchbox Moving Parts 2020 Dodge Charger SRT Hellcat - Mainan Mobil,59900
Matchbox Moving Parts 1964 Buick Rivierra - Mainan Mobil Balap,59900
Matchbox Moving Parts Mazda MX-30 - Mainan Mobil Balap,59900
Matchbox Moving Parts '16 BMW i8 - Mainan Mobil Balap,59900
Matchbox Working Rigs Pierce Quantum Arrial Truck Camion -Mainan Mobil,159900
Hot Wheels Zamac 6 Car Pack - Mainan Mobil Balap,309900
Hot Wheels Monster Trucks Lightyear Zurg - Mainan Mobil Balap,99900
Hot Wheels Skate Ghost Spider - Mainan Fingerboard,124900
Hot Wheels Monster Trucks Live 4x4x4 Big Foot - Mainan Mobil Balap,99900
The Super Mario Bros Movie Mario Jungle Kingdom Raceway - Mainan Trek,949900
Hot Wheels Track Builder Unlimited Split Loop Pack - Mainan Trek Mobil,359900
Hot Wheels Monster Trucks Beast Basher Motosaurus - Mainan Mobil Balap,99900
Hot Wheels Skate Iron Man - Mainan Fingerboard,124900
Hot Wheels Monster Trucks Champion Crashers Race Ace - Mainan Mobil,99900
Hot Wheels Monster Trucks Freestyle Wreckers Melon Mauler - Mainan,99900
Hot Wheels Monster Trucks Arena Smashers Ultimate Crash Yard - Mainan,503930
Hot Wheels Monster Trucks Mash & Crash Tiger Wrex - Mainan Mobil Balap,99900
Hot Wheels Monster Trucks Glow in The Dark 4x4x4 Bigfoot - Mainan,124900
Hot Wheels Monster Trucks Swamp Chomp Playset - Mainan Trek Mobil,519900
Hot Wheels Color Reveal 2 Pack Of Vehicles - Mainan Mobil Balap,279900
Hot Wheels Ultimate Playset with Coloring & Activity Book - Mainan,69900
Matchbox Volkswagen Beetle 4x4 - Mainan Mobil Balap,35900
Matchbox 1974 Volkswagen Type 181 - Mainan Mobil Balap,35900
Matchbox 1962 Volkswagen Beetle Red - Mainan Mobil Balap,35900
Matchbox Volkswagen Type 34 Karmann Ghia - Mainan Mobil Balap,35900
Matchbox 1976 Volkswagen Golf GTI MK1 - Mainan Mobil Balap,35900
Hot Wheels Boulevard LB-ER34 Super Silhoutte Nissan Skyline - Mainan,129900
Hot Wheels Exotic Envy Koenigsegg Agera R - Mainan Mobil Balap,129900
Matchbox Volkswagen Dash U Series Bundle,215400
Hot Wheels Premium Collector Track Day Series - Mainan Mobil Balap,559900
Hot Wheels Track Builder Flame Stunt Park - Mainan Trek Mobil Balap,499900
Hot Wheels Monster Trucks Glow In The Dark Rodger Dodger -Mainan Mobil,124900
Hot Wheels European Car 6 Packs - Mainan Mobil Balap,309900
Matchbox Working Rigs GM Brightdrop Zevo 600 - Mainan Mobil Balap,159900
Matchbox Working Rigs Man TGS MCAB - Mainan Mobil Balap,159900
Matchbox Working Rigs MBX Road Greader - Mainan Mobil Balap,159900
Hot Wheels Fast & Furious Themed 10 Pack - Mainan Mobil Balap,559900
Hot Wheels Premium Fast & Furious 5 Car Packs - Mainan Mobil Balap,849900
Hot Wheels Monster Trucks 2023 Demo Derby - Mainan Mobil Balap,99900
Hot Wheels Monster Trucks 2023 Crush Delivery - Mainan Mobil Balap,99900
Hot Wheels Monster Trucks Jurassic Park Jeep - Mainan Mobil Balap,99900
Hot Wheels Monster Trucks 2023 Brown Bone Shaker - Mainan Mobil Balap,99900
Hot Wheels Mario Kart Luigi Mach 8 - Mainan Mobil Balap,149900
Hot Wheels Mario Kart Shy Guy B-Dasher - Mainan Mobil Balap,149900
Hot Wheels Monster Trucks Humvee - Mainan Mobil Balap,99900
Hot Wheels Monster Trucks Fast & Furious Nissan Skyline - Mainan Mobil,99900
Hot Wheels Team Transport Nissan Silvia (S13) & Sakura Sprinter-Mainan,309900
Hot Wheels Team Transport '23 Ford Mustang RTR Spec 5 & Aero Lift,309900
Hot Wheels Monster Trucks 2023 Blue Bigfoot - Mainan Mobil Balap,99900
Bundle Hot Wheels Ramadhan,433709
Hot Wheels Boulevard Dash P Series Bundle,649500
Matchbox 70th Anniversary Dash A Series Bundle,299500
Hot Wheels Premium Speed Machines Series Bundle,649500
Matchbox 70th Years 1962 Mercedes 220SE Sedan - Mainan Mobil Balap,35900
Matchbox 70th Years 2005 Ford GT - Mainan Mobil Balap,35900
Matchbox 70th Years Freightliner M2 106 - Mainan Mobil Balap,35900
Matchbox 70th Years 2018 Bugatti Divo - Mainan Mobil Balap,35900
Matchbox 70th Years Celebration Dash T Series Bundle,179500
Hot Wheels Drag Strip 1965 Dodge Coronet - Mainan Mobil Balap,129900
Hot Wheels Drag Strip 1964 Chevy Nova Gasser - Mainan Mobil Balap,129900
Hot Wheels Drag Strip 33 Willys - Mainan Mobil Balap,129900
Hot Wheels Drag Strip 1973 Plymouth Duster - Mainan Mobil Balap,129900
Matchbox Moving Parts 1956 Moris Minor - Mainan Mobil Balap,59900
Matchbox Moving Parts Shell Divco - Mainan Mobil Balap,59900
Matchbox Moving Parts 2020 Porsche 911 Carrera 4S - Mainan Mobil Balap,59900
