product_name,product_price_rp
Hot Wheels ID Gotta Go 2 - Mainan Mobil Balap,129900
Hot Wheels ID 12 Ford Fiesta - Mainan Mobil Balap,129900
Hot Wheels ID Custom '67 Pontiac Firebird - Mainan Mobil Balap,129900
Hot Wheels ID Nissan Skyline GT-R (R34) - Mainan Mobil Balap,129900
Hot Wheels ID '19 Ford Ranger Raptor - Mainan Mobil Balap,129900
Hot Wheels Monster Trucks 1:64 (Jeep) - Mainan Mobil Balap,99900
Hot Wheels Monster Trucks 1:64 (Wreckreational) - Mainan Mobil Balap,99900
Hot Wheels Monster Trucks 1:64 (Bone Shaker) - Mainan Mobil,99900
Hot Wheels Monster Trucks 1:64 (Dozen Delivery) - Mainan Mobil Balap,99900
Hot Wheels Monster Trucks 1:64 (Rodger Dodger) - Mainan Mobil,99900
Hot Wheels Monster Trucks 1:64 Haul Y'all - Mainan Mobil,99900
Hot Wheels Monster Trucks 1:64 (Taxi) - Mainan Mobil Balap,99900
Hot Wheels Monster Trucks 1:64 (Spiderman) - Mainan Mobil Balap,99900
Hot Wheels Monster Trucks Monster Mover - Mainan Trek Mobil Balap,539900
Hot Wheels Monster Trucks 1:24 Hotweiler Undead - Mainan Mobil Balap,379900
Hot Wheels Monster Trucks 1:24 Racing - Mainan Mobil Balap,379900
Hot Wheels Monster Trucks 1:24 Torque Terror - Mainan Mobil Balap,379900
Hot Wheels Monster Trucks 1:24 Big Foot Firestone - Mainan Mobil Bala,379900
Hot Wheels Track Builder Unlimited Basic Back - Mainan Trek Mobil,199900
Hot Wheels Beatles Yellow Submarine - Mainan Mobil Balap,129900
Hot Wheels Punisher Van - Mainan Mobil Balap,129900
Hot Wheels The Mystery Machine - Mainan Mobil Balap,129900
Hot Wheels Monster Trucks Octo-Slam Playset - Mainan Trek Mobil Balap,309900
Hot Wheels Monster Trucks Sabretooth Showdown Playset - Mainan Trek,309900
Hot Wheels Monster Trucks Fire Through Playset - Mainan Trek Mobil,309900
Mega Construx Hot Wheels Aristo Rat - Mainan Konstruksi Anak,229900
Mega Construx Hot Wheels Baja Truck - Mainan Konstruksi Anak,229900
Hot Wheels Matchbox 5 Packs Rally II - Mainan Mobil Balap,179900
Hot Wheels Matchbox MBX City Drivers - Mainan Mobil Balap,179900
Hot Wheels Matchbox MBX Exotic - Mainan Mobil Balap,179900
Hot Wheels Matchbox MBX Recue - Mainan Mobil Balap,179900
Hot Wheels Matchbox 5 Packs Blue Highways II - Mainan Mobil Balap,179900
Matchbox Fire Station Rescue Playset - Mainan Trek Mobil Balap,519900
Hot Wheels Track Builder Unlimited Rapid Launch Builder Box,1299900
Hot Wheels Act Massive Loop Mayhem Track Set - Mainan Trek Mobil Balap,1499900
Hot Wheels Act Rollout Raceway Track Set - Mainan Trek Mobil Balap,739900
Hot Wheels Marvel Avengers (Red Skull) - Mainan Mobil Balap,59900
Hot Wheels Monster Trucks 1:64 (Rodger Dodger Purple) - Mainan Mobil,99900
Hot Wheels Monster Trucks 1:64 (Sponge Bob) - Mainan Mobil Balap,99900
Hot Wheels Monster Trucks 1:64 (Tyrannosaurus Rex 2021) - Mainan,99900
Hot Wheels Monster Trucks 1:64 (Land Rover) - Mainan Mobil Balap,99900
Hot Wheels Monster Trucks 1:64 (Will Trash it All 2021) - Mainan Mobil,99900
Hot Wheels Monster Trucks 1:64 (Unigmo 2021) - Mainan Mobil Balap,99900
Hot Wheels Monster Trucks 1:64 (Bionic Bruiser) - Mainan Mobil Balap,99900
Hot Wheels Monster Trucks 1:64 + Crushed Car Combo Rodger Dodger Yello,124900
Hot Wheels Loco Loopster - Mainan Mobil Balap,124900
Hot Wheels Custom Volkswagen Hauler - Mainan Mobil Balap,124900
Hot Wheels Mercedes Benz Actros - Mainan Mobil Balap,124900
Hot Wheels Fuel & Fire - Mainan Mobil Balap,124900
Hot Wheels Monster Trucks 1:64 + Crushed Car Combo Pack Too S'cool,124900
Hot Wheels Monster Trucks 1:64 + Crushed Car Combo Pack Invader,124900
Hot Wheels Monster Trucks 1:64 + Crushed Car Combo Pack Scorpedo,124900
Hot Wheels Fast & Furious Corvette Grand Sport - Mainan Mobil Balap,59900
Hot Wheels Fast & Furious 71 Plymouth - Mainan Mobil Balap,59900
Hot Wheels Fast & Furious Nissan Skyline - Mainan Mobil Balap,59900
Hot Wheels Fast & Furious Ice Charger- Mainan Mobil Balap,59900
Hot Wheels Fast & Furious Dodge Challenger Drift Car - Mainan Mobil,59900
Hot Wheels Boulevard ('67 Pontiac Firebird) - Mainan Mobil Balap,129900
Hot Wheels Boulevard (Lancia Stratos Group 5) - Mainan Mobil Balap,129900
Hot Wheels Boulevard (Corevette Z06 Drag Racer) - Mainan Mobil Balap,129900
Hot Wheels Boulevard (Porsche 964) - Mainan Mobil Balap,129900
Hot Wheels Bell Air Gasser - Mainan Mobil Balap,49900
Hot Wheels Track Pack - Mainan Trek Mobil Balap,54900
Hot Wheels Starter Kit - Mainan Mobil Balap,492500
Hot Wheels 2018 Super Rigs Carnival Steamer - Mainan Mobil Balap,179900
Hot Wheels Hauling Rig Steel Power - Mainan Mobil Balap,179900
Hot Wheels Mario Kart (Donkey Kong),149900
Hot Wheels Mario Kart (Light-Blue Shy Guy) - Mainan Mobil Balap,149900
Hot Wheels Mario Kart (Luigi),149900
Hot Wheels Mario Kart (Mario),149900
Hot Wheels Mario Kart Yoshi,149900
Hot Wheels Mario Kart (Donkey Kong) - Mainan Mobil,249900
Hot Wheels Mario Kart Plane Glider (Toad) - Mainan Mobil Balap,249900
Hot Wheels Track Builder Unlimited Stunt Crash Box - Mainan Trek Mobil,539900
Hot Wheels Fast & Furious Spy Racers Eliminator Vehicle - Mainan,439900
Hot Wheels Premium Collector Nissan GTR Set - Mainan Mobil Balap,559900
Hot Wheels Matchbox Top Gun Maverick - Mainan Mobil Balap,179900
Hot Wheels Matchbox Top Gun Maverick II - Mainan Mobil Balap,179900
Hot Wheels Matchbox MBX Service Crew - Mainan Mobil Balap,179900
Hot Wheels Matchbox Highway Speeder - Mainan Mobil Balap,179900
Hot Wheels Rocket FYR-1 - Mainan Pesawat Terbang,54900
Hot Wheels Flying Dagger - Mainan Pesawat Terbang,54900
Hot Wheels Aero Dynastic - Mainan Pesawat Terbang,54900
Matchbox Moving Parts '06 Ford Crown Victoria - Mainan Mobil Balap,59900
Matchbox Moving Parts '65 Volkswagen Type 3 Fastback - Mainan Mobil,59900
Matchbox Moving Parts '83 Buick Riviera - Mainan Mobil Balap,59900
Matchbox Moving Parts '64 Pontiac Gran Prix - Mainan Mobil Balap,59900
Matchbox Moving Parts 2016 Chevy Camaro - Mainan Mobil Balap,59900
Matchbox Moving Parts '62 Jeep Willys Wagon - Mainan Mobil Balap,59900
Hot Wheels Super Rocket Blast-Off Play Set,579900
Hot Wheels Mario Kart (Waluigi Badwagon) - Mainan Mobil Balap,149900
Hot Wheels Mario Kart (Cat Peach) - Mainan Mobil Balap,149900
Hot Wheels Mario Kart (Lakitu) - Mainan Mobil Balap,149900
Hot Wheels Mario Kart (Toad) - Mainan Mobil Balap,149900
Hot Wheels Mario Kart (Mario) - Mainan Mobil,149900
Hot Wheels Mario Kart (Red Yoshi) - Mainan Mobil Balap,149900
Hot Wheels Mario Kart (Wario) - Mainan Mobil Balap,149900
Hot Wheels Mario Kart (Yoshi) - Mainan Mobil,149900
Hot Wheels City Downtown Playset (Fuel Stop) - Mainan Trek Mobil Balap,249900
Hot Wheels City Downtown Playset (Toxic Fuel Stop) - Mainan Trek Mobil,249900
Hot Wheels City Downtown Playset (Police Station) - Mainan Trek Mobil,249900
Hot Wheels Monster Trucks 1:64 Demolition Doubles 2-Pack Donkey Kong,189900
Hot Wheels Monster Trucks 1:64 Demolition Doubles 2-Pack Big Foot,189900
Hot Wheels Monster Trucks Dodge Charger - Mainan Mobil Balap Anak,379900
Hot Wheels Monster Trucks Arabalar Lava Shark - Mainan Mobil Balap,379900
Hot Wheels Monster Trucks Tyrannosaurus Rex - Mainan Mobil Balap Anak,379900
Hot Wheels Monster Die-Cast Spider-Man - Mainan Mobil Balap Anak,379900
Hot Wheels Stunt & Go Track Set - Mainan Trek Mobil Balap,439900
Hot Wheels Monster Trucks Camion De Los Muertos - Mainan Mobil Balap,379900
Hot Wheels Monster Trucks Bigfoot - Mainan Mobil Balap,99900
Hot Wheels Flying Customs ('55 Chevy) - Mainan Mobil Balap,54900
Hot Wheels Flying Customs ('64 Chevy Nova Wagon) - Mainan Mobil Balap,54900
Hot Wheels Flying Customs ('68 Shelby GT500) - Mainan Mobil Balap,54900
Hot Wheels Flying Customs ('70 Plymouth Barracuda) - Mainan Mobil,54900
Hot Wheels Flying Customs ('70 Ford Mustang Mach 1) - Mainan Mobil,54900
Hot Wheels Flying Customs ('84 Pontiac Firebird) - Mainan Mobil Balap,54900
Hot Wheels Flying Customs (Custom Otto) - Mainan Mobil Balap,54900
Hot Wheels Flying Customs ('71 Plymouth GTX) - Mainan Mobil Balap,54900
Hot Wheels ID '95 Mazda RX-7 Drift - Mainan Mobil Balap,129900
Hot Wheels ID Porsche 918 Spyder - Mainan Mobil Balap,129900
Hot Wheels ID Asphalt Assault - Mainan Mobil Balap,129900
Hot Wheels ID Nissan Silvia (S14) Drift - Mainan Mobil Balap,129900
Hot Wheels ID Speed Dozer - Mainan Mobil Balap,129900
Hot Wheels ID 2020 Corvette - Mainan Mobil Balap,129900
Hot Wheels Monster Trucks 1 Bad Scoop - Mainan Mobil Balap,99900
Hot Wheels Monster Trucks Town Hauler - Mainan Mobil Balap,99900
Hot Wheels Monster Trucks Oscar Mayer - Mainan Mobil Balap,99900
Hot Wheels Fast & Furious Spy Racers (Astana Hotto) Camo,54900
Hot Wheels Fast & Furious Spy Racers (Dune Buggy) - Mainan Mobil Balap,54900
Hot Wheels Fast & Furious Spy Racers (Rally Baja Crawler) Camo,54900
Hot Wheels Basic Car Bundle (Random) - Mainan Mobil Balap,64800
Hot Wheels City Stunt Train Express - Mainan Trek Mobil Balap,899900
Matchbox Fire Rescue Hauler Playset - Mainan Trek Mobil Balap,539900
Boys Play n Fun Box A - Mainan Mobil Balap,309900
Hot Wheels Monster Trucks V8 Bomber - Mainan Mobil Balap,99900
Hot Wheels Monster Truck Motosaurus - Mainan Mobil Balap,99900
Hot Wheels Monster Truck Loco Punk - Mainan Mobil Balap,99900
Hot Wheels Monster Trucks Hot Wheels Delivery - Mainan Mobil Balap,99900
Hot Wheels Monster Truck Demo Derby - Mainan Mobil,99900
Hot Wheels Monster Truck Burger Delivery - Mainan Mobil Balap,99900
Hot Wheels Monster Trucks HW Pizza - Mainan Mobil Balap,99900
Hot Wheels Monster Trucks Hothellers - Mainan Mobil Balap,99900
Hot Wheels Back Road Rally 09 Ford Focus - Mainan Mobil Balap,59900
Hot Wheels Monster Truck Launch Bash - Mainan Trek Mobil,359900
Hot Wheels Character Cars Super Mario Yoshi - Mainan Mobil Balap,89900
Hot Wheels Character Cars Super Mario Princess Peach - Mainan Mobil,89900
Hot Wheels Character Cars Super Mario Bullet Bill - Mainan Mobil Balap,89900
Hot Wheels Character Cars Super Mario Bowser - Mainan Mobil Balap,89900
Hot Wheels Character Cars Super Mario Donkey Monkey - Mainan Mobil,89900
Hot Wheels Character Cars Super Mario Mario - Mainan Mobil Balap,89900
Hot Wheels Character Cars Super Mario Toad - Mainan Mobil Balap,89900
Hot Wheels Character Cars Super Mario Luigi - Mainan Mobil Balap,89900
Hot Wheels Monster Trucks 5 Alarm +Die Cast Car - Mainan Mobil Balap,124900
Hot Wheels Monster Truck Twin Mill - Mainan Mobil Balap,124900
Hot Wheels Monster Truck Bone Shaker - Mainan Mobil Balap,124900
Hot Wheels Forza Horizon 4 Shelby Cobra Daytona Coupe - Mainan Mobil B,59900
Hot Wheels Forza Horizon 4 Porsche 911 GT2 - Mainan Mobil Balap,59900
Hot Wheels Forza Horizon 4 1963 Aston Martin DB5 - Mainan Mobil Balap,59900
Hot Wheels Forza Horizon 4 BMW - Mainan Mobil Balap,59900
Hot Wheels Forza Horizon 4 96 Nissan 180SX - Mainan Mobil Balap,59900
Hot Wheels Forza Horizon 4 Lamborghini Veneno - Mainan Mobil Balap,59900
Hot Wheels Monster Trucks Stunt Tire Play Set - Mainan Trek Mobil,679900
Boys Play n Fun Box B - Mainan Mobil Balap,519900
Matchbox Helicopter Rescue Playset - Mainan Mobil Balap,349900
MatchBox Gas Station Playset - Mainan Mobil Balap,349900
Hot Wheels Toxic Snake Strike - Mainan Trek Mobil Balap,619900
Hot Wheels Monster Trucks V8 Bomber - Mainan Mobil Balap Anak,379900
Hot Wheels Monster Trucks Zombie Wrex - Mainan Mobil Balap Anak,379900
Hot Wheels Monster Trucks Will Trash It All - Mainan Mobil Balap Anak,379900
Hot Wheels Loop and Launch Track Playset - Mainan Mobil Balap Anak,699900
Hot Wheels Track Builder Unlimited Infinity Loop Kit,849900
Hot Wheels Fast Furious Spy Racer Spy Commander Hauler - Mainan Mobil,759900
Hot Wheels Fast and Furious Premium Bundle - Mainan Mobil Balap,699900
Hot Wheels Mario Kart Mario - Mainan,249900
Hot Wheels Mario Kart Luigi - Mainan,249900
Hot Wheels Mario Kart Bowser - Mainan Mobil Balap,249900
Hot Wheels Fast & Furious Buick Grand National - Mainan Mobil Balap,59900
Hot Wheels Fast & Furious 1970 Monte Carlo Beige - Mainan Mobil Balap,59900
Hot Wheels Fast & Furious Nissan 370 Z - Mainan Mobil Balap,59900
Hot Wheels Fast & Furious 1961 Chevrolet Impala - Mainan Mobil Balap,59900
Hot Wheels Fast & Furious 95 Mazda RX-7,59900
Hot Wheels Fast & Furious Mitsubishi Lancer Evolution - Mainan Mobil,59900
Hot Wheels Boulevard 63 Chevy Nova - Mainan Mobil Balap,129900
Hot Wheels Boulevard 2021 Subaru WRX STI - Mainan Mobil Balap,129900
Hot Wheels Boulevard Volkswagen Drag Bus Real Riders - Mainan Mobil Ba,129900
Hot Wheels Boulevard 1968 Mazda Cosmo Sport - Mainan Mobil Balap,129900
Hot Wheels Boulevard 1964 Buick Riviera - Mainan Mobil Balap,129900
Hot Wheels Team Transport Aero Lift - Mainan Mobil Balap,309900
Hot Wheels Team Transport Speed Waze Vehicle - Mainan Mobil Balap,309900
Hot Wheels Team Transport Retro Rig Vehicle - Mainan Mobil Balap,309900
Hot Wheels Team Transport Horizon Hauler & Volkswagen Bug - Mainan,309900
Hot Wheels ID Subaru BRZ - Mainan Mobil Balap,129900
Hot Wheels ID '16 Bugatti Chiron - Mainan Mobil Balap,129900
Hot Wheels ID Arkham Asylum Batmobile - Mainan Mobil Balap,129900
Hot Wheels ID Nissan Skyline GT-R BNR34 - Mainan Mobil Balap,129900
Hot Wheels ID Sting Rod II - Mainan Mobil Balap,129900
Hot Wheels ID Supercharged - Mainan Mobil Balap,129900
Mega Construx Hot Wheels Twin Mill - Mainan Konstruksi Anak,249900
Mega Construx Hot Wheels Solid Muscle - Mainan Konstruksi Anak,249900
Mega Construx Hot Wheels Bone Shaker - Mainan Konstruksi Anak,249900
Mega Construx Hot Wheels Muscle Bound - Mainan Konstruksi Anak,249900
Hot Wheels Ptero Port Attack Playset - Mainan Trek Mobil Balap,399900
Hot Wheels Monster Trucks 1:64 Demolition Doubles (Monster Portions vs,189900
Hot Wheels Monster Trucks 1:64 Demolition Doubles (Michelangelo vs Don,189900
Hot Wheels Monster Trucks 1:64 Demolition Doubles (HW 4 vs HW 1),189900
Hot Wheels Monster Truck 1:24 (Tiger Shark) - Mainan,379900
Hot Wheels Monster Truck 1:24 (Jeep Wrangler) - Mainan Mobil Balap,379900
Hot Wheels Monster Truck 1:24 (Meg-A-Jolt) - Mainan Mobil Balap,379900
Hot Wheels Monster Trucks Monster Maker Sharkruiser - Mainan,169900
Hot Wheels Monster Trucks Monster Maker Bone Shaker - Mainan,169900
Hot Wheels Monster Trucks Monster Maker Scorpedo - Mainan Mobil Balap,169900
Hot Wheels Track Builder Unlimited Premium Curve Pack - Mainan Trek,359900
Hot Wheels Track Builder Unlimited Ultra Boost Kit Motorized Set,1199900
Hot Wheels Color Shifters 5-Pack (Random) - Mainan Mobil Balap,259900
Hot Wheels City Hyper Boost Tire Shop & Town Center Playset - Bundle,1269800
Mega Construx Hot Wheels Monster Trucks Bone Shaker,439900
Hot Wheels Monster Trucks Pit and Launch Mega-Wrex Play Set - Mainan T,339900
Mega Construx Hot Wheels Monster Trucks Tiger Shark - Mainan Balok Sus,439900
Hot Wheels Stuntin Semi Truck ( Red ) - Mainan Mobil Balap,171445
Hot Wheels Monster Trucks 1:64 + Crushed Car Combo Pack Race Ace,124900
Hot Wheels Monster Trucks 1:64 + Crushed Car Combo Pack Motosaurus,124900
Hot Wheels Monster Trucks 1:64 + Crushed Car Combo Pack Torque Terror,124900
Hot Wheels Monster Trucks 1:64 + Crushed Car Combo Pack 5 Alarm,124900
Hot Wheels Land Rover 110 Panel - Mainan Mobil Balap,129900
Hot Wheels Ford RS 200 - Mainan Mobil Balap,129900
Hot Wheels Volkswagen ID R - Mainan Mobil Balap,129900
Hot Wheels Lancer 037 - Mainan Mobil Balap,129900
Hot Wheels '84 Audi Sport Quattro Vehicle - Mainan Mobil Balap,129900
Hot Wheels Porsche 993 GT2 - Mainan Mobil Balap,129900
Hot Wheels Monster Trucks 1:64 (57/75 Ring Master) - Mainan Mobil Bala,99900
Hot Wheels City Spider Park Attack Playset,399900
Hot Wheels Dino Coaster Attack,399900
Hot Wheels City Air Attack Dragon Playset - Mainan Trek Mobil Balap,1199900
Mattel Hot Wheels Stuntin Semi Truck ( Blue ) - Mainan Mobil Balap,179900
Hot Wheels Monster Trucks 1:24 (Hulk) - Mainan Mobil Balap,379900
Hot Wheels Big Rig Heat,179900
Hot Wheels Park N Play Vehicle - Mainan Mobil Balap,179900
Hot Wheels 2020 Super Rigs Tooned Up - Mainan Mobil Balap,179900
Hot Wheels Haulin Horsepower - Mainan Mobil Balap,179900
Hot Wheels Matchbox Working Rigs MBX Mobile Crane - Mainan Mobil Balap,159900
Hot Wheels Matchbox Working Rigs Road Grader - Mainan Mobil Balap,159900
Hot Wheels Matchbox Working Rigs GMC Attenuator 3500 Highway Truck,159900
Hot Wheels Matchbox Working Rigs International MV Box Truck,159900
Hot Wheels Matchbox 2019 Mercedes Benz G-Class G63 AMG 6x6,139900
Hot Wheels Matchbox 1982 Datsun 280ZX Coupe - Mainan Mobil Balap,139900
Hot Wheels Matchbox 1959 Volkswagen Minibus - Mainan Mobil Balap,139900
Hot Wheels Super Rigs Fossil - Mainan Mobil Balap,179900
Hot Wheels ID Lamborghini Centernario Roadster - Mainan Mobil Balap,129900
Hot Wheels ID Track Manga - Mainan Mobil Balap,129900
Hot Wheels ID Classic Batmobile - Mainan Mobil Balap,129900
Hot Wheels ID Ford RS200 - Mainan Mobil Balap,129900
Hot Wheels ID Justice League Batmobile - Mainan Mobil Balap,129900
Hot Wheels ID Nissan Fairlady Z - Mainan Mobil Balap,129900
Hot Wheels Matchbox 1974 Dodge Challenger - Mainan Mobil Balap,139900
Hot Wheels American Steel ASST (Random) - Mainan Mobil Balap,59900
Hot Wheels Speedway Hauler Big Rig Semi Truck - Mainan Mobil Balap,179900
Hot Wheels Trailer Wingstorm - Mainan Mobil Balap,179900
Hot Wheels ID Race Portal - Mainan Trek Mobil Balap,1599900
Hot Wheels Sky Crash Tower Trackset - Mainan Trek Mobil Balap,1099900
Hot Wheels City Hyper Boost Tire Shop Playset - Mainan Trek Mobil,899900
Hot Wheels Pencil Pusher - Mainan Mobil Balap,179900
Hot Wheels Cruisin Illusion - Mainan Mobil Balap,179900
Hot Wheels Fossil Freight - Mainan Mobil Balap,179900
Hot Wheels Road Roller - Mainan Mobil Balap,179900
Hot Wheels Park N Play Truck - Mainan Mobil Balap,179900
Hot Wheels Monster Trucks 1:64 2-Pack (Spider-Man vs Venomized Hulk),189900
Hot Wheels Monster Trucks 1:64 2-Pack (Raphael vs Leonardo) - Mainan,189900
Hot Wheels Dine & Dash Playset - Mainan Trek Mobil Balap,249900
Hot Wheels Ghost Garage Playset - Mainan Trek Mobil Balap,249900
Hot Wheels Blaze Blast Playset - Mainan Trek Mobil Balap,249900
Hot Wheels Turbo Jet Car Wash Playset - Mainan Trek Mobil Balap,249900
Hot Wheels Monster Trucks 1:64 (TMNT Leonardo) - Mainan Mobil Balap,99900
Hot Wheels Monster Trucks 1:64 (Donkey Kong) - Mainan Mobil Balap,99900
Hot Wheels Monster Trucks 1:64 (Araba Dragbus) - Mainan Mobil Balap,99900
Hot Wheels Monster Trucks 1:64 (Shark Wreak) - Mainan Mobil Balap,99900
Hot Wheels Monster Trucks 1:64 (BigFoot) - Mainan Mobil Balap,99900
Hot Wheels Monster Trucks 1:64 (Rodger Dodger) - Mainan Mobil Balap,99900
Hot Wheels Monster Trucks 1:64 (Stunt Storm) - Mainan Mobil Balap,99900
Hot Wheels LAMBORGHINI AVENTADOR BLACK - Mainan Mobil Balap,129900
Hot Wheels ASTON MARTIN DB5 - Mainan Mobil Balap,129900
Hot Wheels MCLAREN 720S - Mainan Mobil Balap,129900
Hot Wheels Monster Trucks 1:43 Twin Mill - Mainan Mobil Balap,249900
Hot Wheels Monster Trucks 1:43 Cyber Crush - Mainan Mobil Balap,249900
Hot Wheels 1966 Chevy Nova - Mainan Mobil Balap,129900
Hot Wheels Buck Grand National - Mainan Mobil Balap,129900
Hot Wheels Ford Gran Torino - Mainan Mobil Balap,129900
Hot Wheels 61 Impala - Mainan Mobil Balap,129900
Hot Wheels FORD F-150 SVT LIGHTNI Vehicle - Mainan Mobil Balap,129900
Hot Wheels Mercedes Benz Unimog - Mainan Mobil Balap,129900
Hot Wheels 67 Camaro Off Road - Mainan Mobil Balap,129900
Hot Wheels Ford Bronco 4X4 - Mainan Mobil Balap,129900
Hot Wheels Porsche 959 - Mainan Mobil Balap,129900
Hot Wheels City Bat Blitz Hospital Attack Playset - Mainan Trek Mobil,399900
Hot Wheels Pizza Planet Truck - Mainan Mobil Balap,129900
Hot Wheels Forz Motorsport Volkswagen Classic Bug - Mainan Mobil Balap,129900
Hot Wheels Toys Story RC - Mainan Mobil Balap,129900
Hot Wheels Scooby-Doo The Mystery Machine - Mainan Mobil Balap,129900
Hot Wheels Rick & Morty Spaceship - Mainan Mobil Balap,129900
Hot Wheels Monster Trucks 1:24 (5 Alarm) #2 - Mainan Mobil Balap,379900
Hot Wheels Monster Trucks 1:24 (Dairy Delivery) - Mainan Mobil Balap,379900
Hot Wheels Monster Trucks 1:24 (Jeep) - Mainan Mobil Balap,379900
Hot Wheels Monster Trucks 1:43 Leopard Shark - Mainan Mobil Balap,249900
Hot Wheels City Robo T-Rex Ultimate Garage - Mainan Trek Mobil Balap,3099900
Hot wheels Track Builder Unlimited Long Jump Pack - Mainan Trek Mobil,359900
Hot Wheels Track Builder Unlimited Loop Kicker Pack - Mainan Trek,359900
Hot Wheels DC The Joker Funhouse - Mainan Trek Mobil Balap,359900
Hot Wheels Rapid Raceway Champion Playset - Mainan Trek Mobil Balap,299900
Hot Wheels Monster Trucks 1:64 (One Bad Ghoul) - Mainan Mobil Balap,99900
Hot Wheels City Downtown Playset (Ice Cream Meltdown) - Mainan Trek,249900
Hot Wheels City Downtown Playset (Burger Dash) - Mainan Trek Mobil,249900
Hot Wheels Premium Collectors Nissan Set - Mainan Mobil Balap,559900
Hot Wheels Premium Collectors Team Transport Vehicle - Mainan Mobil,559900
Hot Wheels Monster Truck Scorpion Sting Raceway Playset - Mainan Trek,949900
Hot Wheels City Stunt Garage Playset - Mainan Trek Mobil Balap,619900
Hot Wheels Drop Race Jump Trackset - Mainan Trek Mobil Balap,499900
Hot Wheels Ultimate Box - Mainan Mobil Balap,499900
Hot Wheels Collector Box - Mainan Mobil Balap,334800
Hot Wheels Monster Trucks 1:24 (Power Wheels BigFoot) - Mainan Mobil,379900
Hot Wheels Monster Trucks 1:24 (5 Alarm) - Mainan Mobil Balap,379900
Hot Wheels Monster Trucks 1:24 (Funny Feelings) - Mainan Mobil Balap,379900
Hot Wheels Honda Civic EG - Mainan Mobil Balap,129900
Hot Wheels Fast & Furious Mazda RX-7 FD - Mainan Mobil Balap,129900
Hot Wheels Fast & Furious Nissan Silvia (S15) - Mainan Mobil Balap,129900
Hot Wheels Fast & Furious Nissan 240SX - Mainan Mobil Balap,129900
Hot Wheels Fast & Furious 2016 Subaru WRX STI - Mainan Mobil Balap,129900
Hot Wheels Fast & Furious 17 Acura NSX - Mainan Mobil Balap,129900
Hot Wheels Fast & Furious 71 Plymouth GTX - Mainan Mobil Balap,129900
Hot Wheels Fast & Furious 70 Dodge Charger - Mainan Mobil Balap,129900
Hot Wheels Fast & Furious 95 Mazda RX-7 - Mainan Mobil Balap,129900
Hot Wheels Fast & Furious Jaguar XE SV Project 8 - Mainan Mobil Balap,129900
Hot Wheels Monster Trucks 1:64 (Chassis Snapper) - Mainan Mobil Balap,99900
Hot Wheels Monster Trucks 1:64 (V8 Bomber) - Mainan Mobil Balap,99900
Hot Wheels Monster Trucks 1:64 (Psycho-Delic) - Mainan Mobil Balap,99900
Hot Wheels Monster Trucks 1:64 (Special Forces) - Mainan Mobil Balap,99900
Hot Wheels Monster Trucks 1:64 (Piran-Ahhh) - Mainan Mobil Balap,99900
Hot Wheels Monster Trucks 1:64 (Will Trash It All) - Mainan Mobil,99900
Hot Wheels Skybuster Planes Aero Junior II - Mainan Pesawat,54900
Hot Wheels Monster Trucks Monster Mover - Mainan Mobil Balap,739900
Hot Wheels Skybuster Planes Airblade - Mainan Pesawat,54900
Hot Wheels Skybuster Planes Stunt Plane - Mainan Pesawat,54900
Hot Wheels Skybuster Planes Duel Tail - Mainan Pesawat,54900
Hot Wheels Monster Trucks Demolition Doubles (Safari vs Wild Streak),189900
Hot Wheels Monster Trucks 1:64 Demolition Doubles ( Raiju vs Kovmori ),189900
Hot Wheels City Ultimate Garage With Shark Attack - Mainan Trek Mobil,2299900
Hot Wheels '71 Porsche 911 Door Slammers 1/5 Car Culture - Mainan Mobi,129900
Hot Wheels '70 Ford Escort RS1600 Door Slammers 5/5 Car Culture - Main,129900
Hot Wheels Alfa Romeo Giulia Sprint GTA Door Slammers 2/5 Car Culture,129900
Hot Wheels '71 Datsun 510 Door Slammers 3/5 Car Culture - Mainan Mobil,129900
Hot Wheels Nissan Skyline RS KDR30 1/5 Japan Historic 3 - Mainan Mobil,129900
Hot Wheels Nissan Silvia CSP311 3/5 Japan Historic 3 - Mainan Mobil Ba,129900
Hot Wheels BMW 2002 Door Slammers 4/5 Car Culture - Mainan Mobil Balap,129900
Hot Wheels '85 Honda City Turbo II 2/5 Japan Historic 3 - Mainan Mobil,129900
Hot Wheels 75 Datsun Sunny Truck B120 4/5 Japan Historic 3 - Mainan Mo,129900
Hot Wheels 68 Mazda Cosmo Sport - Mainan Mobil Balap,129900
Hot Wheels Pearl and Chrome ('32 Ford) - Mainan Mobil Balap,54900
Hot Wheels Disney Pixar (Toy Story Cars) - Mainan Mobil Balap,59900
Hot Wheels Disney Pixar (The Incredibles Cars) - Mainan Mobil Balap,59900
Hot Wheels Disney Pixar (Finding Nemo Cars) - Mainan Mobil Balap,59900
Hot Wheels Disney Pixar (Cars) - Mainan Mobil Balap,59900
Hot Wheels Disney Pixar (Monster Cars) - Mainan Mobil Balap,59900
Hot Wheels Pearl and Chrome (Muscle Speeder) - Mainan Mobil Balap,54900
Hot Wheels Pearl and Chrome (Gazelle GT) - Mainan Mobil Balap,54900
Hot Wheels Pearl and Chrome (Volkswagen T2 Truck) - Mainan Mobil Balap,54900
Hot Wheels Pearl and Chrome ('68 Corvette - Gas Monkey Garage),54900
Hot Wheels Pearl and Chrome ('55 Chevy Bel Air Gasser) - Mainan Mobil,54900
Hot Wheels Pearl and Chrome (Fast-Bed Hauler) - Mainan Mobil Balap,54900
Hot Wheels Monster Trucks 1:64 (Purple One Bad Ghoul) - Mainan Mobil,99900
Hot Wheels Monster Trucks 1:64 (Haul Y'all) - Mainan Mobil Balap,99900
Hot Wheels Monster Trucks 1:64 (Red Invader) - Mainan Mobil Balap,99900
Hot Wheels Monster Trucks 1:64 (Darth Vader) - Mainan Mobil Balap,99900
Hot Wheels Monster Trucks 1:64 (Raticle Racer) - Mainan Mobil Balap,99900
Hot Wheels Monster Trucks 1:64 (Hotwheiler) - Mainan Mobil Balap,99900
Hot Wheels Monster Trucks 1:64 (White Mega Wrex) - Mainan Mobil Balap,99900
Hot Wheels Custom '72 Chevy Luv - Mainan Mobil Balap,59900
Hot Wheels '68 Chevy Nova - Mainan Mobil Balap,59900
Hot Wheels '71 Datsun 510 - Mainan Mobil Balap,59900
Hot Wheels Audi Audacious - Mainan Mobil Balap,59900
Hot Wheels '13 Copo Camaro - Mainan Mobil Balap,59900
Hot Wheels Nissan Skyline RS (KDR30) - Mainan Mobil Balap,59900
Hot Wheels Pocket Launcher Playset - Mainan Trek Mobil Balap,114900
Hot Wheels Team Transport (RWB Porsche 930 Aero Lift) - Mainan Mobil,309900
Hot Wheels Team Transport (787B & Sakura Sprinter) -Mainan Mobil Balap,309900
Hot Wheels Team Transport ('70 Plymouth Superbird Wide Open),309900
Hot wheels Ciy Downtown Police Station Breakout - Mainan Trek Mobil,249900
Hot Wheels Track Stars (Bone Blazers) - Mainan Mobil Balap,124900
Hot Wheels Track Stars (Hitch N' Haul) - Mainan Mobil Balap,124900
Hot Wheels Track Stars (Hiway Hauler) - Mainan Mobil Balap,124900
