product_name,product_price_rp
Matchbox Moving Parts 1990 Toyota MR2 W20 - Mainan Mobil Balap,59900
Matchbox Moving Parts 1963 Ford F-100 - Mainan Mobil Balap,59900
Hot Wheels Corvette 70 Series '19 Corvette ZR1 Convertible - Mainan,59900
Hot Wheels Corvette 70 Series '69 Corvette - Mainan Mobil Balap,59900
Hot Wheels Corvette 70 Series Corvette C8.R - Mainan Mobil Balap,59900
Hot Wheels Corvette 70 Series Corvette Stingray - Mainan Mobil Balap,59900
Hot Wheels Corvette 70 Series '55 Corvette - Mainan Mobil Balap,59900
Hot Wheels Corvette 70 Series C6 Convertte - Mainan Mobil Balap,59900
Hot Wheels Corvette 70 Series '97 Convertte - Mainan Mobil Balap,59900
Hot Wheels Corvette 70 Series '64 Corvette Stingray-Mainan Mobil Balap,59900
Matchbox Moving Parts 2020 BMW M4 Cabriolet - Mainan Mobil Balap,59900
Matchbox Japan Dash C Series Bundle,359400
Hot Wheels City Gator Loop Attack - Mainan Trek Mobil Balap,349900
Hot Wheels Monster Trucks 1:64 Mega Wrex 2023 - Mainan Mobil Balap,99900
Hot Wheels Monster Truck 5-Alarm Fire Crash Challenge,359900
Hot Wheels Monster Trucks 1:64 Demo Ace 2023 - Mainan Mobil Balap,99900
Hot Wheels Monster Truck Race Ace Smash Race Challenge,359900
Hot Wheels Monster Trucks 1:64 Battitude - Mainan Mobil Balap,99900
Hot Wheels Monster Trucks 1:64 Ms. Bigfoot - Mainan Mobil Balap,99900
Hot Wheels Monster Trucks 1:64 Too S'Cool 2023 - Mainan Mobil Balap,99900
Hot Wheels Monster Trucks 1:64 Donkey Kong 2023- Mainan Mobil Balap,99900
Hot Wheels Curve Ramps Orange - Mainan Trek Mobil Balap,32900
Hot Wheels Monster Trucks Oscar Mayer Wienermobile -Mainan Mobil Balap,99900
Hot Wheels Monster Trucks Live Bone Shaker - Mainan Mobil Balap,99900
Hot Wheels City Stunt & Splash Car Wash - Mainan Trek Mobil Balap,639900
Hot Wheels Monster Trucks Samson - Mainan Mobil Balap,99900
Hot Wheels Monster Trucks Loco Punk - Mainan Mobil Balap,99900
Hot Wheels City Ferris Wheel Whirl Playset - Mainan Trek Mobil Balap,779900
Hot Wheels Monster Trucks Triceratops - Mainan Mobil Balap,99900
Hot Wheels Monster Trucks Champion Crasher 5 Alarm -Mainan Mobil Balap,99900
Hot Wheels Monster Trucks Monster Vette - Mainan Mobil Balap,99900
Hot Wheels Monster Trucks Volkswagen Drag Bus - Mainan Mobil Balap,99900
Hot Wheels Track Builder Curve Tracks Trackpack - Mainan Trek Mobil,32900
Hot Wheels Track Builder Lightning Boost Pack -Mainan Trek Mobil Balap,519900
Hot Wheels Track Builder Ice Crash Playset - Mainan Trek Mobil Balap,359900
Hot Wheels The Batman Vs Superman '11 Dodge Charger RT - Mainan Mobil,59900
Hot Wheels The Classic TV Series Batmobile Black - Mainan Mobil Balap,59900
Hot Wheels The Dark Knight Series Batmobile Blue - Mainan Mobil Balap,59900
Hot Wheels The Dark Knight Series Batmobile White - Mainan Mobil Balap,59900
Hot Wheels Tha Animated Series Batman Batplane - Mainan Mobil Balap,59900
Matchbox Japan Series B-1963 Honda T360 - Mainan Mobil Balap,59900
Matchbox Japan Series B-2023 Nissan Z - Mainan Mobil Balap,59900
Matchbox Japan Series B-Mitsubishi Lancer Celeste - Mainan Mobil Balap,59900
Matchbox Japan Series B-2004 Honda S2000 - Mainan Mobil Balap,59900
Matchbox Japan Series B-1982 Datsun 280 ZX - Mainan Mobil Balap,59900
Matchbox Japan Series B-1994 Mitsubishi Lancer Evolution IV - Mainan,59900
Matchbox Japan Series J-3 Mazda MX -30 - Mainan Mobil Balap,59900
Matchbox Japan Series J-5 Toyota FJ Cruiser - Mainan Mobil Balap,59900
Hot Wheels Ronin Run '95 Mazda RX7 - Mainan Mobil Balap,129900
Matchbox Japan Series J-2 Datsun 280 ZX - Mainan Mobil Balap,59900
Matchbox Japan Series J-4 1962 Honda T360 - Mainan Mobil Balap,59900
Hot Wheels Ronin Run '98 Subaru Impreza 22B-STi Version - Mainan Mobil,129900
Matchbox Japan Series J-1 2004 Honda A2000 - Mainan Mobil Balap,59900
Hot Wheels Ronin Run Nissan 300ZX Twin Turbo - Mainan Mobil Balap,129900
Hot Wheels Ronin Run '81 Toyota Starlet KP61 - Mainan Mobil Balap,129900
Matchbox Japan Series J-6 2022 Nissan GTR Nismo - Mainan Mobil Balap,59900
Hot Wheels Ronin Run Mazda RX7 FC Pandem - Mainan Mobil Balap,129900
[Defect Box] Matchbox Action Drivers Airport Adventure - Mainan Trek,999900
Hot Wheels Skate Tony Hawk Gargoyle Grinder - Mainan Fingerboard,104900
Hot Wheels Skate Tony Hawk Tic Tac Towed - Mainan Fingerboard,104900
Hot Wheels Skate Tony Hawk Shredator - Mainan Fingerboard,104900
Hot Wheels Fast & Furious Mazda RX-7 FD White - Mainan Mobil Balap,129900
Hot Wheels Skate Tony Hawk Radiant Ripper - Mainan Fingerboard,104900
Hot Wheels Fast & Furious Jeep Grand Cherokee Trackhawk - Mainan Mobil,129900
Hot Wheels Fast & Furious 1967 Chevy Camaro Offroad White - Mainan,129900
Hot Wheels Fast & Furious - Nissan Skyline GT-R (BNR34) - Mainan Mobil,129900
Hot Wheels City Speedy Pizza Pick-Up - Mainan Trek Mobil Balap,149900
Hot Wheels Skate Tony Hawk Bright Flight - Mainan Fingerboard,104900
Hot Wheels Skate Tony Hawk Soldier Grind - Mainan Fingerboard,104900
Hot Wheels Skate Tony Hawk Tribal Domination - Mainan Fingerboard,104900
Hot Wheels Skate Tony Hawk Tricked Out Pack - Mainan Fingerboard,349900
Hot Wheels Skate Tony Hawk Neon Fury - Mainan Fingerboard,104900
Hot Wheels Fast & Furious Porsche 718 Cayman GT4 White - Mainan Mobil,129900
Hot Wheels Japan Series Dash B Series Bundle,299500
Hot Wheels Monster Trucks Super Mario (Bowser) - Mainan Mobil Balap,124900
Hot Wheels Night Shifter Sprinkle Blue - Mainan Mobil Balap,59900
Matchbox Sky Busters Snow Explorer - Mainan Mobil Balap,45430
Hot Wheels Monster Trucks Mercedes-Benz Unimog - Mainan Mobil Balap,99900
Hot Wheels Monster Trucks 2023 Grey Godzilla - Mainan Mobil Balap,99900
Hot Wheels Bone Shaker Red - Mainan Mobil Balap,59900
Hot Wheels Monster Trucks 2023 Ratical Racer - Mainan Mobil Balap,99900
Hot Wheels Monster Trucks Super Mario (Mario) - Mainan Mobil Balap,124900
Hot Wheels Monster Trucks Race Ace Blue - Mainan Mobil Balap,99900
Matchbox Sky Busters A-10A Thunderbolt - Mainan Mobil Balap,64900
Hot Wheels Muscle Tones Blue - Mainan Mobil Balap,59900
Hot Wheels Monster Trucks 2023 Night Shifter - Mainan Mobil Balap,99900
Hot Wheels Monster Trucks MOTU Skeletor - Mainan Mobil Balap,99900
Hot Wheels Monster Trucks 2023 Carbonator XXL Red - Mainan Mobil Balap,99900
Hot Wheels Monster Trucks Super Mario (Luigi) - Mainan Mobil Balap,124900
Matchbox Top Gun Maverick Boeing F7A-18 Hornet - Mainan Mobil Balap,64900
Hot Wheels Monster Trucks Super Mario (Yoshi) - Mainan Mobil Balap,124900
Hot Wheels Solid Muscle White - Mainan Mobil Balap,59900
Matchbox Top Gun Maverick Darkstar Grey - Mainan Mobil Balap,64900
Hot Wheels Monster Trucks 2023 Gotta Dump - Mainan Mobil Balap,99900
Hot Wheels Mopar Series '71 Dodge Challenger - Mainan Mobil Balap,59900
Hot Wheels Mopar Series Dodge Viper SRT10 ACR - Mainan Mobil Balap,59900
Hot Wheels Mopar Series Dodge Challenger Drift Car - Mainan Mobil,59900
Hot Wheels Mopar Series '68 Dodge Dart - Mainan Mobil Balap,59900
Hot Wheels Mopar Series '15 Dodge Charger SRT - Mainan Mobil Balap,59900
Matchbox 2007 Porsche 911 GT3 Green - Mainan Mobil Balap,35900
Matchbox Porsche Cayman White - Mainan Mobil Balap,35900
Matchbox 1971 Porsche 914 Orange - Mainan Mobil Balap,35900
Matchbox Porsche Cayenne Turbo Red - Mainan Mobil Balap,35900
Matchbox Porsche Panamera Yellow - Mainan Mobil Balap,35900
Matchbox 1985 Porsche 911 Rally Black - Mainan Mobil Balap,35900
Hot Wheels JDM Themed 2023 Multipack Case 6 - Mainan Mobil Balap,309900
Hot Wheels Premium Collector Multipack Case 4 - Mainan Mobil Balap,559900
Hot Wheels Car Culture Auto Strasse '73 Volvo 142 GL - Mainan Mobil,129900
Hot Wheels Car Culture Auto Strasse '72 Mercedes-Benz 280 sel 4.5,129900
Hot Wheels Jay Leno's Series Jay Leno Tank Car - Mainan Mobil Balap,129900
Hot Wheels Jay Leno's Series McLaren F1 - Mainan Mobil Balap,129900
Hot Wheels Car Culture Auto Strasse Alpine A110 - Mainan Mobil Balap,129900
Hot Wheels Jay Leno's Series Mercedes-Benz 300 SL - Mainan Mobil Balap,129900
Hot Wheels Jay Leno's Series '66 Chevrolet Corvair Yenko Stinger,129900
Hot Wheels Boulevard Green Custom '70 Chevy Nova - Mainan Mobil Balap,129900
Hot Wheels Car Culture Auto Strasse Lamborghini Urus - Mainan Mobil,129900
Hot Wheels DC The Dark Knight Batmobile - Mainan Mobil Balap,59900
Hot Wheels Boulevard Aero Sculpt - Mainan Mobil Balap,129900
Hot Wheels Boulevard '18 Ford Mustang RTR Spec 5 - Mainan Mobil Balap,129900
Hot Wheels DC Batmobile - Mainan Mobil Balap,59900
Hot Wheels Boulevard '70 Rover P6 Group 2 - Mainan Mobil Balap,129900
Hot Wheels DC Batman Classic TV Series Batmobile - Mainan Mobil Balap,59900
Hot Wheels Jay Leno's Series Red Lamborghini Countach LP 5000 QV,129900
Hot Wheels DC The Batman Batmobile - Mainan Mobil Balap,59900
Hot Wheels DC Golden Batmobile - Mainan Mobil Balap,59900
Hot Wheels Car Culture Auto Strasse Red BMW M3 - Mainan Mobil Balap,129900
Hot Wheels Monster Trucks Silverado Vs Raptor F150 - Mainan Mobil,189900
Hot Wheels Monster Trucks Donkey Kong Vs Bowser - Mainan Mobil Balap,189900
Hot Wheels Monster Trucks Drag Bus Vs Volkswagen Beetle - Mainan Mobil,189900
Hot Wheels Monster Trucks Buns of Steel Vs All Fried Up - Mainan Mobil,189900
Matchbox Moving Parts '80 Porsche 911 Turbo - Mainan Mobil Balap,59900
Matchbox Moving Parts 1936 Ford Sedan Custom - Mainan Mobil Balap,59900
Matchbox Moving Parts 1965 Land Rover Gen II Pick-up - Mainan Mobil,59900
Matchbox Moving Parts 2016 Range Rover Evoque - Mainan Mobil Balap,59900
Matchbox Moving Parts 2018 Nissan Leaf - Mainan Mobil Balap,59900
Matchbox Moving Parts 2017 Tesla Model X - Mainan Mobil Balap,59900
Matchbox Moving Parts Volkswagen Golf MK3 - Mainan Mobil Balap,59900
Hot Wheels Team Transport '16 Mercedes AMG - Mainan Mobil Anak,309900
Hot Wheels Monster Trucks Carbonator XXL Vs Ibad Scoop - Mainan Mobil,189900
Hot Wheels Monster Trucks Buzz Lightyear Vs Zurg - Mainan Mobil Balap,189900
Hot Wheels Monster Trucks Hissy Fit Vs Ratical Racer - Mainan Mobil,189900
Hot Wheels Team Transport MG Metro 6R4 - Mainan Mobil Anak,309900
Hot Wheels Monster Trucks Snack Bite Vs Bigfoot - Mainan Mobil Balap,189900
Matchbox Porsche Dash S Series Bundle,215400
Hot Wheels Mopar Dash A Series Bundle,299500
Hot Wheels Monster Trucks Chromochemous - Mainan Mobil Balap,169900
Hot Wheels DC Dash A Series Bundle,299500
Matchbox Retro Series 1975 Cadillac Eldorado Convertible,36900
Matchbox Retro Series 1990 Volkswagen Golf Country - Mainan Mobil,36900
Hot Wheels Monster Trucks Snack Bite - Mainan Mobil Balap,99900
Hot Wheels Monster Trucks 2023 (1956) Hi-Tall hauler - Mainan Mobil,99900
Hot Wheels Monster Trucks 2023 Red Planet Rager - Mainan Mobil Balap,99900
Hot Wheels Monster Trucks Glow in the Dark (Battitude) - Mainan Mobil,124900
Hot Wheels Monster Trucks Tiger Sharks - Mainan Mobil Balap,99900
Hot Wheels Monster Trucks 2023 Mega Wrex - Mainan Mobil Balap,99900
Hot Wheels Monster Trucks Jurassic World Dominion Beta - Mainan Mobil,124900
Hot Wheels Monster Trucks Nicklodeon Spongebob Squarepants,99900
Matchbox Japan Dash B Series Bundle,359400
Hot Wheels Car Culture Ronin Run Series Bundle,649500
Hot Wheels Attacking Shark Escape Playset - Mainan Trek Mobil Balap,1299900
Matchbos Sky Busters Sea Arrow - Mainan Mobil Balap,64900
Matchbox Sky Busters Aero Junior II - Mainan Mobil Balap,64900
Matchbox Retro Series Subaru SVX - Mainan Mobil Balap,36900
Matchbox Retro Series MBx Turf Hauler - Mainan Mobil Balap,36900
Matchbox Sky Busters Blade Force - Mainan Mobil Balap,64900
Matchbox Sky Busters MBX Rescue Helicopter - Mainan Mobil Balap,64900
Matchbox Retro Series 1969 Chevrolet Camaro - Mainan Mobil Balap,36900
Matchbox Retro Series Corvette T-top - Mainan Mobil Balap,36900
Hot Wheels Fast & Furious '77 Pontiac Firebird T/A - Mainan Mobil,129900
Hot Wheels Fast & Furious '87 Buick Regal GNX - Mainan Mobil Balap,129900
Hot Wheels Fast & Furious '70 Chevrolet Nova SS - Mainan Mobil Balap,129900
Hot Wheels Fast & Furious '86 Dodge Charger - Mainan Mobil Balap,129900
Hot Wheels Fast & Furious '99 Ford F-150 SVT Lightning - Mainan Mobil,129900
Hot Wheels Car Culture Auto Strasse Series Bundle,649500
Hot Wheels Ready to Play Box - Mainan Mobil Balap,1305800
Matchbox Action Drimers Volcano Escape Playset - Mainan Trek Mobil,1399900
Hot Wheels Monster Trucks 2023 Pink Piran-ahhhh - Mainan Mobil Balap,99900
Hot Wheels Monster Trucks 2023 Back To Future Iced Time Machine,99900
Matchbox 1962 Volkswagen Beetle Blue - Mainan Mobil Balap,36900
Matchbox Porsche Cayenne Turbo Black - Mainan Mobil Balap,36900
Matchbox Mercedes-Benz Black GLE Coupe - Mainan Mobil Balap,36900
Matchbox 1985 Porsche 911 Rally Brown - Mainan Mobil Balap,36900
Matchbox Volkswagen EV4 Blue - Mainan Mobil Balap,36900
Matchbox 2019 Audi TT RS Coupe Red - Mainan Mobil Balap,36900
Hot Wheels Skate Tony Hawk Sky Shredder - Mainan Fingerboard,104900
Hot Wheels Skate Tony Hawk Electrick Grind - Mainan Fingerboard,104900
Hot Wheels Skate Tony Hawk Car and Fingerboard Set Gazella GT,159900
Hot Wheels Skate Tony Hawk Pink Skull Grind - Mainan Fingerboard,104900
Hot Wheels Skate Tony Hawk Vision Grind - Mainan Fingerboard,104900
Hot Wheels Skate Tony Hawk Car and Fingerboard Set Cruise Bruiser,159900
Hot Wheels Skate Tony Hawk Chiing Trickster - Mainan Fingerboard,104900
Hot Wheels Skate Tony Hawk Skull Ride - Mainan Fingerboard,104900
Hot Wheels Skate Tony Hawk Melting Glory - Mainan Fingerboard,104900
Hot Wheels Skate Tony Hawk Charged-Up Champ - Mainan Fingerboard,104900
Hot Wheels Skate Tony Hawk Jet-Shark Air - Mainan Fingerboard,104900
Hot Wheels Skate Tony Hawk Car and Fingerboard Set Bat Deck,159900
Hot Wheels Skate Tony Hawk Bone Skater - Mainan Fingerboard,104900
Hot Wheels Skate Tony Hawk Bodacious Ripper - Mainan Fingerboard,104900
Hot Wheels Skate Tony Hawk Car and Fingerboard Set Baja Truck,159900
Hot Wheels Skate Tony Hawk T-Rex & Roll - Mainan Fingerboard,104900
Hot Wheels Skate Tony Hawk Car and Fingerboard Set Bone Shaker,159900
Hot Wheels Skate Tony Hawk Koalattack - Mainan Fingerboard,104900
Hot Wheels Skate Tony Hawk Car and Fingerboard Set Nitro Tailgater,159900
Matchbox Germany Series Dash E Bundle,221400
Hot Wheels 2022 Tony Hawk Donut Skatepark with Exclusive Board & Skate,419900
Hot Wheels Ultra Hots '67 Shelby GT-500 - Mainan Mobil Balap,59900
Hot Wheels Premium Jay Leno's Garage Series Bundle,649500
Hot Wheels Monster Trucks Wreckin' Raceway Playset - Mainan Trek Mobil,1099900
Matchbox Working Rigs Western Star 6900XD Wrecker - Mainan Mobil Balap,159900
Matchbox Working Rigs International Workstar Street Cleaner,159900
Matchbox Working Rigs MBX Excavator - Mainan Mobil Balap,159900
Hot Wheels 2020 Koegnigsegg Jesko - Mainan Mobil Balap,59900
Hot Wheels Monster Trucks Land Rover 90 - Mainan Mobil Balap,99900
Hot Wheels '71 Porsche 911 - Mainan Mobil Balap,59900
Hot Wheels Mclaren P1 Oranye - Mainan Mobil Balap,59900
Hot Wheels '17 Acura NSX - Mainan Mobil Balap,59900
Hot Wheels Masterpiece the Lion King The Vanster - Mainan Mobil Balap,59900
Hot Wheels Beauty and The Beast '49 Merc - Mainan Mobil Balap,59900
Hot Wheels The Nightmare before Christmas Kool Kombi - Mainan Mobil,59900
Hot Wheels Monster Trucks Steer Clear 2023 - Mainan Mobil Balap,99900
Hot Wheels Monster Trucks Will Trash It All - Mainan Mobil Balap,99900
Hot Wheels Monster Truck Good Luck Trolls - Mainan Mobil Balap,99900
Hot Wheels Monster Truck Board Wild 2023 - Mainan Mobil Balap,99900
Hot Wheels Monster Trucks Bread Boyz 2023 - Mainan Mobil Balap,99900
Hot Wheels 2020 Ford Mustang Shelby GT500 - Mainan Mobil Balap,59900
Hot Wheels Monster Trucks Big Foot 2023 - Mainan Mobil Balap,99900
Hot Wheels Monster Trucks 5 Alarm Red - Mainan Mobil Balap,99900
Hot Wheels Flying Customs '68 El Camino - Mainan Mobil Balap,54900
Hot Wheels Flying Customs Custom Volkswagen Beetle - Mainan Mobil,54900
Hot Wheels Flying Customs '67 Custom Mustang - Mainan Mobil Balap,54900
Hot Wheels Flying Customs '73 Pontiac Firebird - Mainan Mobil Balap,54900
Hot Wheels Premium Exotic Envy 2022 Series Bundle,649500
Hot Wheels Ultra Hots Nissan Silvia (S14) Drift - Mainan Mobil Balap,59900
Hot Wheels Ultra Hots '68 Mercury Cougar - Mainan Mobil Balap,59900
Hot Wheels Ultra Hots Honda Civic Si - Mainan Mobil Balap,59900
Matchbox 1971 Pontiac Firebird Formula - Mainan Mobil Balap,35900
Matchbox 1968 Dodge D-200 Pickup - Mainan Mobil Balap,35900
Hot Wheels Ultra Hots Volkswagen SP2 -Mainan Mobil Balap,59900
Hot Wheels Monster Trucks Jeep Plus Connect and Crash Car,99900
Hot Wheels Ultra Hots '70 Pontiac Firebird - Mainan Mobil Balap,59900
Matchbox 1956 Ford F-100 Pickup - Mainan Mobil Balap,35900
Matchbox Local Cruissers 1969 Chevy Camaro - Mainan Mobil Balap,35900
Hot Wheels Ultra Hots '71 Chevy El Camino - Mainan Mobil Balap,59900
Hot Wheels Monster Trucks Bear Devil Plus Connect and Crash Car,99900
Matchbox 2019 Ford Mustang GT - Mainan Mobil Balap,35900
Matchbox Chevy Corvette T Top - Mainan Mobil Balap,35900
Hot Wheels Monster Trucks Volkswagen Beetle Plus Connect and Crash Car,99900
Hot Wheels Mario Kart Standart Kart Peach - Mainan Mobil Anak,149900
Hot Wheels Ultra Hots 1974 Brazilian Dodge Charger - Mainan Mobil,59900
Hot Wheels World Class Racers Series Bundle,299500
Hot Wheels Boulevard Lykan Hypersport - Mainan Mobil Balap,129900
Hot Wheels Boulevard Land Rover Defender 90 - Mainan Mobil Balap,129900
Hot Wheels Boulevard Volkswagen Classic Bug - Mainan Mobil Balap,129900
Hot Wheels Boulevard Baja Bouncer - Mainan Mobil Balap,129900
Hot Wheels Boulevard '70 Plymouth Superbird - Mainan Mobil Balap,129900
Hot Wheels Boulevard DMC Delorian - Mainan Mobil Balap,129900
Hot Wheels Boulevard Volkswagen Deluxe Station Wagon,129900
Hot Wheels Boulevard '67 Austin Mini Pickup - Mainan Mobil Balap,129900
Hot Wheels Monster Trucks Rodger Dodger Plus Connect and Crash Car,99900
Hot Wheels Boulevard '75 Bre Datsun Sunny Truck (B120),129900
Hot Wheels Boulevard Nissan Laurel 2000 SGX - Mainan Mobil Balap,129900
Hot Wheels Monster Trucks Hotweiler Plus Connect and Crash Car,99900
Hot Wheels Boulevard Volkswagen Drag Bus - Mainan Mobil Balap,129900
Hot Wheels Boulevar d '66 Pontiac GTO - Mainan Mobil Balap,129900
Hot Wheels Monster Trucks Pure Muscle Plus Connect and Crash Car,99900
Hot Wheels Monster Trucks Cage Rattler Plus Connect and Crash Car,99900
Hot Wheels Boulevard Volvo P220 Amazon State - Mainan Mobil Balap,129900
Hot Wheels Exotic Envy Mclaren Speedtail - Mainan Mobil Balap,129900
Hot Wheels Exotic Envy '69 Alfa Romeo 33 Stradale - Mainan Mobil Balap,129900
Hot Wheels Exotic Envy '94 Bugatti EB110 - Mainan Mobil Balap,129900
Hot Wheels Monster Trucks Color Shifters Rodger Dodger - Mainan Mobil,169900
Hot Wheels Monster Trucks Color Shifters Bone Shaker - Mainan Mobil,169900
Hot Wheels Monster Trucks Color Shifters Town Hauler - Mainan Mobil,169900
Hot Wheels Monster Trucks Color Shifters Podium Crasher - Mainan Mobil,169900
Hot Wheels Monster Trucks T-Rex Volcano Arena - Mainan Trek Mobil,2799900
Hot Wheels Mario Kart Pipe Frame (Mario) - Mainan Trek Mobil Balap,249900
Hot Wheels City Burger Blitz - Mainan Trek Mobil Balap,249900
Hot Wheels Mario Kart Light Blue (Yoshi) - Mainan Trek Mobil Balap,249900
Hot Wheels Themed Ryura LX - Mainan Mobil Balap,59900
Hot Wheels Themed Batman The Animated Series - Mainan Mobil Balap,59900
Hot Wheels Matchbox Local Cruissers 2018 Ford Mustang - Mainan,35900
Hot Wheels Matchbox Local Cruisers 1972 Ford Bronco 4x4,35900
Hot Wheels Monster Trucks Masters of The Universe Battle Cat,99900
Hot Wheels Matchbox Local Cruisers International Scout 4x4 - Mainan,35900
Hot Wheels Matchbox Local Cruisers Jeep Slipperlift - Mainan,35900
Hot Wheels Matchbox Local Cruisers 1971 Chevelle SS Convertible,35900
Hot Wheels Monster Trucks Tri-To-Crush-Me - Mainan Mobil Balap,99900
Hot Wheels Matchbox Local Cruisers 2020 Corvette - Mainan Mobil Balap,35900
Hot Wheels Monster Trucks Rodger Dodger 2022 - Mainan Mobil Balap,99900
Hot Wheels Monster Trucks 5 Alarm - Mainan Mobil Balap,99900
Hot Wheels Monster Trucks Podium Crasher 2022 - Mainan Mobil Balap,99900
Hot Wheels Premium Collector BMW M Series - Mainan Mobil Balap,559900
Hot Wheels Matchbox 1976 Honda Civic CVCC- Mainan Mobil Balap,35900
Matchbox Sky Busters Grumman Boeing F/A-18 Super Hornet - Mainan,64900
Matchbox Sky Busters Grumman F-14 Tomcat - Mainan Pesawat,64900
Hot Wheels Themed Batman Arkham Knight - Mainan Mobil Balap,59900
Hot Wheels Themed Batman Batmobile - Mainan Mobil Balap,59900
Hot Wheels Monster Trucks Glow in the Dark (Scorpedo) - Mainan Mobil,124900
Hot Wheels Blister Protector Reguler,7900
Hot Wheels Blister Protector Premium,9900
Hot Wheels Japan Series A Bundle,359400
Hot Wheels Monster Trucks Double Destruction Playset - Mainan Trek,459900
Matchbox Sky Busters Cessna Caravan - Mainan Mobil Balap,64900
Matchbox Sky Busters P-38 Lightning - Mainan Mobil Balap,64900
Matchbox Sky Busters MBX 6-2 Airliner - Mainan Mobil Balap,64900
Matchbox Sky Busters Biplane A - Mainan Mobil Balap,64900
Matchbox Sky Busters MBX Crop Duster - Mainan Mobil Balap,64900
Matchbox Sky Busters Enemy Strike Jet - Mainan Mobil Balap,64900
Hot Wheels Track Builder Unlimited Corkscrew Twist Kit - Mainan Trek M,899900
Hot Wheels Multi-Loop Raceoff - Mainan Trek Mobil Balap,899900
Hot Wheels Monster Trucks Car Chompin' Mega-Wrex Vehicle - Mainan,1099900
Hot Wheels Track Stars Steamin Gleamin - Mainan Mobil Balap,124900
Hot Wheels Track Stars Mr. Big - Mainan Mobil Balap,124900
Hot Wheels Track Stars Haulin Class - Mainan Mobil Balap,124900
Hot Wheels Track Stars Speed Fleet - Mainan Mobil Balap,124900
Hot Wheels City Dragon Drive Firefight - Mainan Trek Mobil Balap,799900
Matchbox Top Gun Maverick Boeing F/A-18 Super Hornet - Mainan Mobil,64900
Hot Wheels Team Transport Custom 70 Chevy Nova Horizon Hauler - Mainan,279900
Hot Wheels 1966 TV Series Batmobile Black Car - Mainan Mobil Balap,129900
Hot Wheels 2022 Retro Entertainment DC The Batman Batmobile - Mainan,129900
Hot Wheels Back To The Future Part III Delorean Time Machine 1955,129900
Hot Wheels Disney Pixar Onward Guinevere - Mainan Mobil Balap,129900
Hot Wheels MARVEL Studios Thanoscopter - Mainan Mobil Balap,129900
Hot Wheels MOTU Land Shark - Mainan Mobil Balap,129900
Hot Wheels The Mystery Machine (Scooby-Doo) - Mainan Mobil Balap,129900
Hot Wheels Horizon Hauler with Mcewen 71 Plymouth Duster,309900
Hot Wheels Team Transport Sakura Spinter Porsche 962 - Mainan Mobil,309900
Hot Wheels Monster Bear Devil - Mainan Mobil Balap,99900
Hot Wheels Monster Trucks Defender- Mainan Mobil Balap,99900
Hot Wheels Monster Trucks Mega Wrex - Mainan Mobil Balap,99900
Hot Wheels Monster Trucks Tiger Shark (Green)- Mainan Mobil Balap,99900
Hot Wheels Demolition Double Carbonator XXL VS 1 Bsd Scoop,189900
Hot Wheels Monster Trucks Demolition Double Too Scool vs Demo Derby,189900
Hot Wheels Monster Trucks Demolition Doubles Buzz Lightyear Vs Zurg,189900
Hot Wheels Matchbox Retro Series 1968 Dodge D200 - Maiana Mobil Balap,36900
Hot Wheels Matchbox Retro Series 1970 Plymouth Cuda - Maiana Mobil,36900
Hot Wheels Matchbox Retro Series 1976 Honda CVCC - Maiana Mobil Balap,36900
Hot Wheels Matchbox Retro Series 1976 international Scout 4x4,36900
Hot Wheels Matchbox Retro Series 2000 Nissan Xterra - Maiana Mobil,36900
Hot Wheels Matchbox Retro Series Mitsubishi Eclipse - Maianan,36900
Hot Wheels Matchbox 62 Volkswagen Beetle Mainan Mobil Balap,36900
Hot Wheels Matchbox Mercedes-Benz GLE Coupe- Mainan Mobil Balap,36900
Hot Wheels Matchbox Mercedes-Benz Unimog U 5023 - Mainan Mobil Balap,36900
Hot Wheels Matchbox Porsche 918 Spyder - Mainan Mobil Balap,36900
Hot Wheels Matchbox Porsche Cayenne Turbo - Mainan Mobil Balap,36900
Hot Wheels Matchbox Scania P 360 Fire truck - Mainan Mobil Balap,36900
Hot Wheels Matchbox 1968 DS 21 Pallas - Mainan Mobil Balap,36900
Hot Wheels Matchbox 2018 Bugatti Divo - Mainan Mobil Balap,36900
Hot Wheels Matchbox 2019 McLaren 720S Spider - Mainan Mobil Balap,36900
Hot Wheels Matchbox 2022 Renault Megane - Mainan Mobil Balap,36900
Hot Wheels Matchbox Citroen Ami - Mainan Mobil Balap,36900
Hot Wheels Matchbox Renault Master Ambulance - Mainan Mobil Balap,36900
Hot Wheels Monster Trucks Glow in the Dark Piran - AHHHH - Mainan,124900
Hot Wheels Monster Trucks Glow in the Dark Shark wreak - Maianan Mobil,124900
Hot Wheels Color Reveal Cars Red Blind Pack - Mainan Mobil Balap,279900
Hot Wheels Color Reveal Cars Grey Blind Pack - Mainan Mobil Balap,279900
Hot Wheels Color Reveal Cars Orange Blind Pack - Mainan Mobil Balap,279900
Hot Wheels Monster Trucks 1:43 Bone Shaker Blue - Mainan Mobil Balap,279900
Hot Wheels Monster Trucks 1:43 Ragin Cajun - Mainan Mobil Balap,279900
Hot Wheels Monster Trucks 1:43 Twisted Tredz - Mainan Mobil Balap,279900
Hot Wheels Monster Trucks Carbonator XXL - Mainan Mobil Balap,99900
Hot Wheels Monster Trucks Masters of the Universe Skeletor - Mainan,99900
Hot Wheels Monster Trucks Monster Maker - Mainan Mobil Balap,169900
Hot Wheels Monster Trucks Bone Shaker Snow- Mainan Mobil Balap,99900
Hot Wheels Monster Trucks VW Drag Bus - Mainan Mobil Balap,99900
Hot Wheels Monster Trucks X-Wreckers Piran-AHHHH - Mainan Mobil Balap,99900
Hot Wheels Monster Trucks Delivery - Mainan Mobil Balap,99900
Hot Wheels Matchbox 1985 Toyota 4Runner - Mainan Mobil Balap,35900
Hot Wheels Monster Trucks Tiger Shark - Mainan Mobil Balap,99900
Matchbox Sky Busters CH-47 Cinook - Mainan Mobil Balap,64900
Matchbox Sky Busters Boeing 747-8 Intercontinental - Mainan Mobil,64900
Hot Wheels Matchbox 2008 Honda Civic Type R White - Mainan Mobil Balap,35900
Matchbox Sky Busters Air Grabber - Mainan Mobil Balap,64900
Matchbox Sky Busters Northrop Grumman B-2 - Mainan Mobil Balap,64900
Hot Wheels Matchbox 2019 Mazda 3 Pure Red Hatchback - Mainan Mobil,35900
Hot Wheels Matchbox 1971 Nissan Skyline GTX Blue 2000 - Mainan Mobil,35900
Hot Wheels Matchbox Subaru Impreza Police Black WRX - Mainan Mobil,35900
Hot Wheels Steam Drop & Score - Mainan Trek Mobil Balap,389900
